news ID,url,title,time,content
ltn2017050705410,http://news.ltn.com.tw/news/life/breakingnews/2059401,臉書也可欣賞螢火蟲 書寫家葉曄這麼做...,2017/05/07 05:41,〔記者楊綿傑／台北報導〕不同的季節有不同種類可以欣賞的東西，例如櫻花季、杜鵑花季等，隨著時序進到螢火蟲季，華人世界知名書寫家葉曄也在臉書上放了一隻螢火蟲，短短半小時就吸引破萬人次朝聖，也算是另類的螢火蟲行程。葉曄擅長書寫及使用各種暈染效果營造出療癒的畫面，常吸引許多人觀賞。此次在其發布的螢火蟲影片中，首先先畫出一隻黑黑的螢火蟲本體，隨後再以黃綠色墨水，於螢火蟲尾端點出發光效果，最後寫上螢火蟲三個字。有網友就驚嘆「開頭以為是蟑螂，有點害怕，原來是螢火蟲」，也有網友回應說「蟑螂長久都被人害怕，希望葉曄未來也畫個蟑螂發聲一下」，葉曄在其貼文中感嘆，「蟑螂人人喊打，屁股點個燈就變得受人歡迎」，他除歡迎大家分享賞螢地點外，也提醒大家欣賞就好，不要破壞環境，才能永續」。
ltn2017050705000,http://news.ltn.com.tw/news/business/breakingnews/2059410,打臉川普  股神巴菲特：煤不會東山再起,2017/05/07 05:00,〔中央社〕美國總統川普（DonaldTrump）正致力重振不斷走下坡的美國煤炭產業，但億萬富豪投資家、股神巴菲特（WarrenBuffett）今天駁斥表示，他懷疑煤炭能東山再起。巴菲特於旗下波克夏哈薩威公司（BerkshireHathaway）在內布拉斯加州奧瑪哈（Omaha）總部舉行的年度股東大會上表示，「如果你與煤炭掛鉤，你將會惹上麻煩。隨著時間推移，煤炭勢必會沈淪。」巴菲特因為能看懂趨勢和市場以及擅長投資獲利，被美國人譽為「奧瑪哈的先知」。美國煤炭產業過去數十年來一直不斷萎縮。官方數據顯示，1923年時，此產業雇用86.2萬勞工，至2016年僅雇用8.1萬人。川普和煤礦工人相信，如果美國退出致力削減溫室氣體排放的全球性努力，即2015年巴黎氣候協定訂下的目標，則他們將能扭轉日薄西山的煤炭產業。但諸如億萬富豪、前紐約市長彭博（MichaelBloomberg）等懷疑論者認為，煤炭走下坡主要是由於自動化以及轉移至更容易取得的化石燃料，諸如石油和天然氣等。在去年美國總統大選期間支持民主黨候選人希拉蕊．柯林頓（HillaryClinton）的巴菲特，未在股東大會上直接批評川普。
ltn2017050703440,http://news.ltn.com.tw/news/world/breakingnews/2059408,中間派馬克宏遭駭  法國總統誓言回應,2017/05/07 03:44,〔中央社〕法國中間派總統候選人馬克宏（EmmanuelMacron）競選陣營遭駭客攻擊，數以千計外洩電郵和文件被公布在網路上。法國總統歐蘭德今天承諾，必會對馬克宏遭駭做出回應。法新社和英國廣播公司（BBC）報導，歐蘭德（FrancoisHollande）走訪巴黎文化機構時表示，「我們知悉於總統大選期間存在這些風險，因為別的地方發生過。絕對不會毫無回應。」歐蘭德又說：「倘若有任何干預或盜用，必然會啟動程序。我們必須展開調查。」法國選舉委員會已警告媒體記者，不要在總統大選投票前夕揭露外洩資訊的內容。那些文件於5日午夜稍前在社群媒體上散播，馬克宏陣營指責那是意圖「顛覆民主，如同上次美國總統大選期間出現的情形般。」歐蘭德又說，「由於我們曉得存在這些行動以及這類威脅，我們一直高度警戒。」歐蘭德表示，他無法明言這是否如同馬克宏陣營指控般，是意圖顛覆大選。馬克宏將於7日的總統大選第2輪決選，與極右派候選人瑪琳．雷朋（MarineLePen）對決。當局已警告法國媒體和大眾，散播外洩文件內容將會違反嚴格選舉法令，且可能面臨刑事罪名。根據5日午夜生效的法令規定，在投票所於當地時間7日晚間8時（格林威治時間18時）關閉前，不得從事可能會左右選舉結果的任何宣傳活動或媒體報導。
ltn2017050702120,http://news.ltn.com.tw/news/world/breakingnews/2059403,坦尚尼亞小學校車失控墜谷  35死,2017/05/07 02:12,〔中央社〕警方表示，1輛小學校車今天早上在坦尚尼亞北部阿魯沙（Arusha）觀光區失控衝出道路墜入深谷，造成32名學童、2名教師以及校車司機喪命。阿魯沙區警察首長姆坤博（CharlesMkumbo）透過電話告訴路透社，「當那輛小型巴士在雨中自陡峭山丘下坡時發生事故，我們仍在調查事故原因，判定是否機械故障抑或司機人為疏失肇禍。」姆坤博表示，這起事故於早上約9時30分發生在卡拉圖縣（Karatu）境內，喪命學生是年齡12到13歲的幸運文森小學（LuckyVincentprimaryschool）學童，當時他們正搭車造訪另一所學校。坦尚尼亞總統馬古富利（JohnMagufuli）發表聲明，形容這起事故是「國家悲劇」。坦尚尼亞是東非第二大經濟體，境內道路安全網絡拙劣，但巴士依然是城鎮間主要公共交通工具。根據坦尚尼亞政府資料，2014至2016年超過1萬1000人命喪道路事故。
ltn2017050700300,http://news.ltn.com.tw/news/society/breakingnews/2059394,3歲童顱內出血、下體菸疤命危 母親、繼父涉嫌虐童,2017/05/07 00:30,〔記者蔡宗憲／屏東報導〕屏東驚傳虐童導致命危案件，一名3歲陳姓男童，2日在家中疑似頭部遭到重創，4日在家中嚴重抽搐昏迷，經地區醫院診療緊急轉送高雄長庚兒童醫院，目前仍在加護病房未脫離險境，雖然黃姓繼父及陳姓母親強調是孩子跌落樓梯，但嚴重顱內出血加上下體有菸疤，警方認為父母涉嫌重大，安置陳童1歲弟弟後，將2人依重傷害罪移送法辦。6日緊急進行開腦手術的3歲陳姓男童阿川（化名），2日因為不斷嘔吐送醫，醫院診斷為腸胃炎，沒想到4日下午，阿川突然在家中不斷抽搐陷入昏迷，緊急送醫發現有嚴重顱內出血情況，連夜送到高雄長庚醫院加護病房插管急救，至今仍未脫離險境，院方認為有虐童嫌疑通報警方。當地警方據報後，5日由屏東地檢署檢察官核發拘票拘提兩夫妻到案，黃姓繼父供稱，2日帶阿川外出返家，孩子興奮的要爬上樓梯找媽媽，沒想到不慎跌落約2公尺高的樓梯撞傷頭部，因當下僅額頭浮腫無異狀，並沒有就醫，後來不斷嘔吐，醫院也判定是腸胃炎，不知道他傷勢嚴重。陳婦向警方表示，這個孩子平常比較調皮，確實曾拿塑膠棒懲罰，但孩子玩耍時也常跌倒碰撞，她非常疼愛這個孩子，9月還準備讓他上托兒所，絕對沒有毆打或嚴重體罰他。警方初步調查，夫婦供稱的「跌下樓梯」，不太可能造成嚴重顱內出血，懷疑有推撞的情況，此外，男童下體及身上有多處菸疤及傷痕，顯見孩子遭體罰已經不是第一次，報請檢察官偵辦後，先以緊急保護令安置阿川的1歲弟弟，並依重傷害罪嫌將夫婦2人移送屏東地檢署。據了解，涉嫌虐童的23歲陳姓少婦夫妻，陳婦離婚後帶著3歲的阿川及1歲幼子，上月才改嫁20歲、有竊盜前科的黃姓男子，陳婦平常全職在家帶孩子，臉書大頭照也是跟2孩子恩愛合照，不過卻也曾抱怨長子阿川「有人規定小孩就是要那麼壞嗎？」
ltn2017050700270,http://news.ltn.com.tw/news/world/breakingnews/2059358,85歲老翁再戰珠峰 壯志未酬在基地營過世,2017/05/07 00:27,尼泊爾老翁舍川日前打算以85歲的高齡奪回攻頂聖母峰最年長的頭銜，但週六傳出在基地營過世了。（美聯社）〔即時新聞／綜合報導〕尼泊爾老翁舍川（MinBahadurSherchan）曾經一度擁有聖母峰攻頂成功最年長頭銜，後來這項紀錄被另一名高齡的登山家打破，他日前打算以85歲的高齡奪回攻頂聖母峰最年長的紀錄，但週六傳出在基地營過世了。舍川在2008年曾以76歲的高齡登上聖母峰，創下最年長的攻頂紀錄，但這項紀錄後來在2013年被另一名80歲的日本登山家三浦雄一郎打破。舍川在上個月則於加德滿都的自宅中表示，希望能再度挑戰登上聖母峰，並曾表示，他的目標不是要打破任何人的紀錄，只是想對自己證明，他還有登上世界最高峰的能耐。但據外媒報導，尼泊爾官員指出，舍川於當地時間週六下午5點多已在基地營辭世，有報導引述醫生的推測指出，舍川可能是因為心臟病發而過世，但因山上通訊條件不佳，確切原因仍有待進一步確認。
ltn2017050700220,http://news.ltn.com.tw/news/society/breakingnews/2059399,狼師案慢半拍 南檢深夜急澄清：要保護「當事人」,2017/05/07 00:22,〔記者王捷／台南報導〕狼師案檢方被批被動，直到5月1日秘密分案調查，5月4日才對外宣布「有作為」，不過有內部檢察官爆料，事實上28日就有檢察官，送了分案報告，卻沒有下文，28日時南檢在林家服喪之際，對外宣稱家屬提告會究辦，令部分檢察官氣憤認為，南檢作法不合法理情，南檢遭揭露後6日深夜急澄清，並沒有檢察官送報告，28日晚間有接到檢舉就有作為，不便公開原因是因為性侵案要保護「當事人」。爆料檢察官指出，主動偵查是檢察官的天職，就如同警察看到路邊有人打架，一定會上前阻止，總不會等著這些人被打傷等著傷者報案，不過南檢28日卻對外宣稱，因為資訊過於片段，要等家屬提告，但實務上檢方遇到性侵案，即使被害人沒有出面指證，檢方也會分案調查。不過，南檢慢半拍一事被本報揭露後，6日深夜急澄清，28日檢方看到林奕含雙親澄清後極為重視，但尊重家屬意願，待事證明確後再分案調查，不過28日晚間就有接到「民眾」告發，因此當下襄閱檢察官就指示婦幼組分析當事人聲明資料、蒐集相關媒體報導，先進行部分偵查作為。由於4月29、30日為假日，5月1日南檢隨即分案積極偵辦，並未有延誤，且性侵案為了保護「當事人」，不便對外詳細說明。
ntk2017050713460,https://newtalk.tw/news/view/2017-05-07/86093,《英雄聯盟》MSI巴西季中賽東南亞代表GAM取得最後一張小組賽門票,2017/05/07 13:46,《英雄聯盟》2017 MSI季中邀請賽入圍賽，今（7）日舉行小組賽最後一天的比賽，由兩支隊伍敗部的隊伍分別為土耳其代表SuperMassive（SUP）以及東南亞代表GIGABYTE Marines（GAM）來爭奪最後一張小組賽的門票。最終 GAM 3:1 擊敗了 SUP，取得了勝利，將與閃電狼、TSM一同進入 MSI 的小組賽。第一局比賽，GAM 從早期就不斷得開起團戰，打得 SUP 無法招架，在遊戲時間 24 分時就以 24:6 的人頭比數取得壓倒性的勝利，先馳得點。到了第二局比賽雙方開局相當的膠著，直到遊戲15分鐘SUP靠著上路選手fabFabulous一波傳送中路，成功幫助隊伍打出了一波一換四漂亮的團戰，奠定了勝利，SUP贏得第二局的勝利，雙方拉成 1:1 平手。到了至關重要的第三局，GAM 先是靠著漂亮的中野連動，打出人頭優勢，並在遊戲時間31分鐘在巴龍池口抓到了SUP的隊員進而打出一波零換五的團戰取下勝利，率先聽牌。而到了最後一局，雖然SUP先是在 ban pick(角色禁選)取得了在這個版本較為強勢的中路角色「勒布朗」，但GAM也想出了應對，使用了罕見角色「歷山卓」不但限制了許多「勒布朗」的發揮，積極得發起團戰更是讓 GAM 的隊員完全無法發育。最後頂著極大經濟優勢的 GAM 遊戲時間22分鐘就踏上了 SUP 的高地，贏得會戰之後取下主堡，笑納小組賽門票。東南亞戰區一直以來都給觀眾帶來無限的驚奇，不但在日前將知名北美勁旅 TSM 逼到了絕境，今日三比一展現的積進隊伍風格更是讓眾人印象深刻，也期待日後他們在季中賽的表現。 （喜歡這條新聞，給新頭殼按個讚！）   
ntk2017050713420,https://newtalk.tw/news/view/2017-05-07/86097,淡水這樣最好玩！七大主題旅遊讓你玩遍滬尾不落勾,2017/05/07 13:42,新北市的淡水在經過不同時代文化的薰陶，留下許多豐富的文化資產，可以說是臺灣重要的旅遊勝地。新北市政府所屬新北市立淡水古蹟博物館今（７）日規劃「淡水迷人好日子-一日半日文化輕旅行」，推出七條主題旅遊路線，帶領民眾玩透透淡水古蹟。淡水古蹟博物館安排七條主題旅遊路線，包含「大手浪漫牽小手 約會當然這樣走」、「體力特別好－貪吃貪玩貪看一網打盡」、「親子假日小旅行」、「大河小體驗－親子半日輕鬆走」、「馬偕博士他這樣走－水岸、洋風、咖啡香」、「忠肝藝膽半日文青」及「淡水卡麥拉－鏡頭下的淡水」等各種小旅行，民眾藉由搭乘公車、渡船、騎乘腳踏車或步行等交通方式自由選擇自己喜歡的旅遊主題。其中「大手浪漫牽小手 約會當然這樣走」更是甜蜜指數破表，從日式風情的淡水街長多田榮吉故居出發，眺望淡水河岸美景，接著品嘗淡水小吃阿給，再到婚紗拍攝勝地前清淡水關稅務司官邸，在美麗的白色拱圈迴廊下許諾山盟海誓，沿著真理街小徑抵達馬偕故居、姑娘樓和牧師樓，稍作休息，享用下午茶後，到理學堂大書院談情說愛，紅毛城更見證馬偕夫婦的婚禮，落日時分散步到海關碼頭，欣賞浪漫的夕陽景緻，留下張張愛的回憶合照。此外，特別推薦私房觀賞淡水夕照秘境，位於海關碼頭的西段登船斜坡，面向淡水河出海口，無任何遮蔽物，是絕佳觀夕位置。黃澄澄的太陽逐漸沒入地平線，一片片的橘黃也隨著渲染蔚藍的天空，天際化成繽紛色彩，讓人讚嘆淡水之美。新北市立淡水古蹟博物館館長柏麗梅表示，藉由七條主題路線串起淡水文化資產，民眾可深度走訪淡水，認識淡水的歷史文化，也感受淡水的魅力。 （喜歡這條新聞，給新頭殼按個讚！）   
ntk2017050713260,https://newtalk.tw/news/view/2017-05-07/86099,戴資穎衣寬破壞效果 柯文哲怒批：辦不好就扣錢,2017/05/07 13:26,針對世界羽球球后戴資穎昨天出席「戴資穎全英公開賽冠軍紀念悠遊卡記者會」，主辦單準備的衣服太大了，破壞活動宣傳效果，引發台北市長柯文哲不悅一事，柯文哲今(7)日表示，公關公司要辦就應辦好，「辦不好就扣錢」。柯文哲今天是在出席「第五屆愛天使樂活園遊會」，接受媒體訪問時，做了上述表示。由於世界羽球球后戴資穎昨天在出席「戴資穎全英公開賽冠軍紀念悠遊卡記者會」時，主辦單位準備給戴資穎穿的台北世大運衣服，因為衣服太大，讓她必須捲起衣袖，據悉，此事讓柯文哲十分不悅。柯文哲今天受訪時表示，公關公司要辦就要辦好，辦不好就要扣錢，花錢請公關公司來做，就要讓選手打扮得美美的，準備的衣服太大，當然不對，所以他就跟悠遊卡公司董事長林向愷說，「這個要扣錢」。柯文哲強調，選手參加國際賽事，如果衣服太大不合身，就是贊助廠商要注意的事；就台北市政府而言，花錢請公關公司來做，就是要做好，怎麼可以讓選手打扮成這個樣子!（喜歡這條新聞，給新頭殼按個讚！）   
ntk2017050713220,https://newtalk.tw/news/view/2017-05-07/86096,生、養育補助金不一 柯文哲：應有更好的規則,2017/05/07 13:22,針對各縣市提供生育及育兒津貼補助不一，引發新手父母搶遷戶口一事，台北市長柯文哲今(7)日出席「愛天使5樂活園遊會」活動受訪時表示，台灣很多社會獎勵與補助都不是法令，而讓各縣市自行處理，但這不是好辦法，應有更好的規則。為了搶拚生育，各縣市紛紛祭出優惠的生育及育兒津貼，希望吸引新手父母入籍，引發一場各縣市福利搶人戰，專家學者認為，政府不應放任各縣市政各自為政，建議政府應統一核發養育補助金。對此，柯文哲表示，台灣很多的社會獎勵與補助都不是法令規定，都是讓各縣市政府自行處理，而財政較好的縣市，比較願意挪錢去做社會補助，但這不是好辦法，他認為應該要有更好的規則。柯文哲舉例說，從重陽敬老金開始，到生育補助、育兒津貼及幼稚園補助，各縣市的補助都不一樣，造成一個很大的問題，應該要拿出來討論；至於是否要統一補助，他表示，應該要有更好的規則。柯文哲指出，其實核發生育補助也沒有解決問題，「生了還是要養」，就算目前的補助金額2萬5再往上拉，也沒有解決這個問題。他表示，台北市目前有辦理幼稚園補助，不過，他發現戶籍在台北市，但不在台北市念幼稚園的有6千個，原因是台北市4歲念幼稚園有補助，家長的心態是不拿白不拿，這確實是個問題；至於要如何解決，柯文哲說，還沒有想出來。（喜歡這條新聞，給新頭殼按個讚！）   
ntk2017050713170,https://newtalk.tw/news/view/2017-05-07/86098,法國總統大選第2輪 馬克宏雷朋今天決戰,2017/05/07 13:17,法國中間派總統候選人馬克宏（Emmanuel Macron）與極右派候選人瑪琳．雷朋（Marine Le Pen）的總統大選第2輪決選，巴黎時間7日上午8時（台北時間7日下午2時）開始投票。法國國際廣播電台報導，法國總統大選二輪投票，5月6日巴黎時間中午12時開始海外選民投票，法國海外屬地選民陸續投票。法國海外省選民大約有280萬。在外國居住的130萬法國選民可以到法國在當地設立的投票站（通常是法國學校或領館）參加投票。法國本土投票站7日8時開門。全法4750萬選民可到全國6萬6456個投票站去投票。當局出動5萬警力對投票站進行維安和應對投票後的集會遊行。（喜歡這條新聞，給新頭殼按個讚！）   
ntk2017050712240,https://newtalk.tw/news/view/2017-05-07/86095,汽、柴油8日零時起各調降0.3元及0.4元,2017/05/07 12:24,中油公司依浮動油價機制計算，自明（8）日凌晨零時起調降各式汽油價格每公升0.3元、各式柴油價格每公升0.4元，調整後的參考零售價格分別為92無鉛汽油每公升23.4元、95無鉛汽油每公升24.9元、98無鉛汽油每公升26.9元、超級柴油每公升20.9元。中油公司表示，本週原油價位雖有美國商用原油庫存連4降的利多護航，但是，受到利比亞產量驟增與市場信心不足的影響，油價仍處低檔震盪。中油公司指出，本週調價指標7D3B週均價為每桶49.06美元，較前週50.33美元，下跌1.27美元；新台幣對美元匯率升值0.076元，國內油價依公式計算跌幅為2.21%，汽、柴油每公升各調降0.3元、0.4元。（喜歡這條新聞，給新頭殼按個讚！）   
ntk2017050712010,https://newtalk.tw/news/view/2017-05-07/86094,舉辦12年 「全國學生戲劇比賽」首見三冠王,2017/05/07 12:01,由教育部舉辦、已長達12年的「全國學生創意戲劇比賽」，今年由彰化縣鹿港國中榮獲史無前例橫跨3大戲劇類組「舞臺劇類」、「現代偶戲類手套偶戲組」及「傳統偶戲類布袋戲組」的特優獎項。「全國學生創意戲劇比賽」自103學年度由「全國學生創意偶戲比賽」正式更名為「全國學生創意戲劇比賽」，並因應增加「舞臺劇類」，鼓勵學校具表演藝術興趣的學生組隊參賽。為響應該賽事，彰化縣政府3年前首度辦理縣內初賽，並於去年舉辦「學生創意戲劇比賽教師研習」，邀請各領域專長老師指導，終於在今年將學生生活與在地特色融入劇本創作中，成為突出的關鍵。手套偶戲「阿龍騎遇記」，利用時下流行的「穿越劇」表現手法，講述偷騎機車的少年，以「早知道」神仙不斷變動偷騎機車的後果，讓整場戲引人入勝。再加上該戲有著橫向、縱向、3D上視圖的多重視角切換，極具創意且視覺效果佳。舞臺劇「小紅帽」劇本改編自經典童話故事，講述一個愛跳舞的女孩想完成夢想的故事，因為媽媽曾經學舞受傷，對於女兒想加入舞蹈甄選有莫大的擔心。戲劇中融入舞蹈元素，表現出小紅帽的內心拉扯，是劇情亮點之ㄧ。而小紅帽與大野狼共同遇到的親子溝通問題，是劇情亮點之二。雖然故事架構簡單，但藉由密集訓練、極佳的默契與團隊合作精神，讓整齣戲精彩呈現。傳統布袋戲「奪玉璽」是延續前兩年全國賽「溫酒斬華雄」、「三英戰呂布」的劇情。今年則與彰化的在地特色完美結合，是學生創意戲劇比賽裡首次有文場南管及武場北管搭配應用，學生更展現布袋戲專業口語及操偶技術，加上喝馬龍頭與四句聯特色口白的搭配，足以媲美專業的野臺布袋戲。教育部表示，鹿港國中獲獎的實例，希望能帶領更多學校發掘有戲劇興趣的學子，讓學校藝術教育充分獲得發展，培育並鼓舞更多好手，更多詳情可上網搜尋「全國學生戲劇比賽」瀏覽。（喜歡這條新聞，給新頭殼按個讚！）   
ntk2017050711240,https://newtalk.tw/news/view/2017-05-07/86092,中共海空軍遠海長訓 馮世寬：台灣不得不提升戰備,2017/05/07 11:24,國防部長馮世寬今(7)天上午在淡江大學戰略研究所演講指出，中共的航母數量增加，海空軍遠海長訓將成為固定訓練模式，突破第一島鏈更擴大到第二島鏈，讓台灣不得不提升戰備因應。馮世寬上午出席2017淡江戰略學派年會暨「第十三屆紀念鈕先鍾老師國際學術研討會—新形勢下的台灣國家安全戰略」，並進行開幕演講。馮世寬表示，未來黃海和東海將不能滿足中共航空母艦戰鬥群訓練，遠海長訓不僅將成為固定訓練模式，還會不斷擴大到第二島鏈，可預見中共的文攻武嚇不會停止。馮世寬說，早年中共的戰機船艦僅能在他們自己沿海邊飛行和訓練， 現在他們則經常到海峽中線，如遼寧號航空母艦和轟六型戰機已可以突破第一島鏈繞行台灣，帶給國軍非常大的壓力，不得不提升戰備因應。對於總統蔡英文日前提出「新情勢、新問卷、新模式」的兩岸互動「三新」主張，要在變動的情勢中，讓兩岸維持和平穩定的狀態，共同思考對兩岸和平穩定、區域安定繁榮有利的架構。但馮世寬認為，身為國防部長，他要提醒大家，中共的文攻武嚇不會停止。台灣不樂見和中共兵戎相見，一直以來謹守兩岸現狀的政治承諾，不向中共挑釁，時時防止意外發生；他還指出，台灣不是沒有能力，但不會向朝鮮一樣發展核武。他說，兩岸和平及區域安全穩定發展，是政府長期以來追求的目標，國家安全戰略是政治經濟軍事外交和深化民主，保持靈活策略，也要和第一島鏈相關國家保持均衡友好發展關係。（喜歡這條新聞，給新頭殼按個讚！）   
