news ID,url,title,time,content
udn2017050711430,https://udn.com//news/story/6809/2447808?from=udn-ch1_breaknews-1-99-news,馬克宏遭駭選委會阻散播 傳對手忙轉發,2017/05/07 11:43,法新社報導，駭客在當地時間昨天午夜前不久，將數以千計電郵與文件傾倒到網路上，接著再由爆料網站「維基解密」（Wikileaks）接手披露。馬克宏（Emmanuel Macron）國內與海外的政敵在社群媒體上散播各項指控，但因法規嚴禁投票前1天進行任何競選活動，馬克宏及其陣營都不能對此進一步回應。法國選舉委員會發表聲明說：「散播這些用不正當手段取得，且極有可能摻雜虛假資訊的資料，恐觸犯刑事罪。」委員會說：「在對我們制度最重要選舉的前夕，委員會呼籲在網站、社群媒體上發文的每1個人，主要是媒體，所有公民也一樣，都應展現負責態度，不要轉發這種內容，才不會扭曲了這場選舉的真實。」不過馬克宏對手、極右派的瑪琳．雷朋（MarineLe Pen）支持者，據傳將遭駭檔案中的文件截圖公布在網路上。馬克宏競選團隊警告相關內容可能包含假資訊。雷朋資深幕僚菲利波（Florian Philippot）在推特上暗示，外洩內容可能涵蓋媒體曾刻意壓下的資訊。這場難以預測的選戰本身已充斥醜聞和驚奇，以及候選人間的脣槍舌戰，駭客事件將造成何種衝擊無從評估。根據路透社，紐約網路情報公司「閃點」（Flashpoint）研究主任克雷梅茲（Vitali Kremez）表示，他研究發現，與俄羅斯軍事情報局（GRU）密不可分的團體「APT 28」，是這起外洩事件的幕後主謀。法新社報導，駭客在當地時間昨天午夜前不久，將數以千計電郵與文件傾倒到網路上，接著再由爆料網站「維基解密」（Wikileaks）接手披露。馬克宏（Emmanuel Macron）國內與海外的政敵在社群媒體上散播各項指控，但因法規嚴禁投票前1天進行任何競選活動，馬克宏及其陣營都不能對此進一步回應。法國選舉委員會發表聲明說：「散播這些用不正當手段取得，且極有可能摻雜虛假資訊的資料，恐觸犯刑事罪。」委員會說：「在對我們制度最重要選舉的前夕，委員會呼籲在網站、社群媒體上發文的每1個人，主要是媒體，所有公民也一樣，都應展現負責態度，不要轉發這種內容，才不會扭曲了這場選舉的真實。」不過馬克宏對手、極右派的瑪琳．雷朋（MarineLe Pen）支持者，據傳將遭駭檔案中的文件截圖公布在網路上。馬克宏競選團隊警告相關內容可能包含假資訊。雷朋資深幕僚菲利波（Florian Philippot）在推特上暗示，外洩內容可能涵蓋媒體曾刻意壓下的資訊。這場難以預測的選戰本身已充斥醜聞和驚奇，以及候選人間的脣槍舌戰，駭客事件將造成何種衝擊無從評估。根據路透社，紐約網路情報公司「閃點」（Flashpoint）研究主任克雷梅茲（Vitali Kremez）表示，他研究發現，與俄羅斯軍事情報局（GRU）密不可分的團體「APT 28」，是這起外洩事件的幕後主謀。
udn2017050711390,https://udn.com//news/story/7266/2447820?from=udn-ch1_breaknews-1-99-news,新屋國中810聯絡簿又有新作 師母也來參一咖,2017/05/07 11:39,學生時代若能有一位幽默趣味的老師陪伴，念書之餘還能用不同的方式與老師「交流」，以後回想時，必定饒富趣味。去年九月新屋國中8年10班導師陸昌孝在班級粉絲頁上，PO出與學生在聯絡簿以詩詞對決，連連敗陣，大喊「我的腦漿快用完了」而爆紅，八個多月以來，新屋國中8年10班仍每天都有不同驚喜，有趣的是五月新添生力軍，連師母也加入戰局，讓原本想放棄的學生反而更有信心持續投入「對穿腸」的戰局。陸昌孝說，5月初學生暗諷導師腦筋空白想放棄了，沒想到下筆時又一篇接一篇，「想來一詩腦空白，左思右想心好煩，原想放棄不想詩，誰知下筆又一篇。」後來由師母接手回應，「腦筋空白就該休，無思無緒卻成詩，每每都來這一招，存心氣死笨老師。」，不但說自己的丈夫是「笨老師」，還說「哈哈哈，我也會寫詩耶，但不會押韻」，讓陸昌孝不禁有感而發寫下「老公腦漿不夠用，老婆代打罵我笨，這是招誰又惹誰，學生老婆傷我重。」，但也表現出夫妻倆的幽默與好感情。學生隔天也不甘示弱再回覆「師母果真夠水準，借刀殺人露真心，面對如此笨老師，整他還比唸書勤。」，陸昌孝也回說，「人笨才來當老師，若是聰明成醫師，回家處理聰明妻，怎會嫁給笨老師。」讓學生家長與網友們看得哈哈大笑，為生活增添不少趣味。其實，從8年10班的聯絡簿中可以看出陸昌孝對學生的用心與安慰，有時陸昌孝是學生的老師、有時像是爸爸、有時也像是可以互虧的好友，甚至不管怎麼虧，他都能保有幽默、好脾氣的態度回應，這也是師生維護感情的獨特方式。學生時代若能有一位幽默趣味的老師陪伴，念書之餘還能用不同的方式與老師「交流」，以後回想時，必定饒富趣味。去年九月新屋國中8年10班導師陸昌孝在班級粉絲頁上，PO出與學生在聯絡簿以詩詞對決，連連敗陣，大喊「我的腦漿快用完了」而爆紅，八個多月以來，新屋國中8年10班仍每天都有不同驚喜，有趣的是五月新添生力軍，連師母也加入戰局，讓原本想放棄的學生反而更有信心持續投入「對穿腸」的戰局。陸昌孝說，5月初學生暗諷導師腦筋空白想放棄了，沒想到下筆時又一篇接一篇，「想來一詩腦空白，左思右想心好煩，原想放棄不想詩，誰知下筆又一篇。」後來由師母接手回應，「腦筋空白就該休，無思無緒卻成詩，每每都來這一招，存心氣死笨老師。」，不但說自己的丈夫是「笨老師」，還說「哈哈哈，我也會寫詩耶，但不會押韻」，讓陸昌孝不禁有感而發寫下「老公腦漿不夠用，老婆代打罵我笨，這是招誰又惹誰，學生老婆傷我重。」，但也表現出夫妻倆的幽默與好感情。學生隔天也不甘示弱再回覆「師母果真夠水準，借刀殺人露真心，面對如此笨老師，整他還比唸書勤。」，陸昌孝也回說，「人笨才來當老師，若是聰明成醫師，回家處理聰明妻，怎會嫁給笨老師。」讓學生家長與網友們看得哈哈大笑，為生活增添不少趣味。其實，從8年10班的聯絡簿中可以看出陸昌孝對學生的用心與安慰，有時陸昌孝是學生的老師、有時像是爸爸、有時也像是可以互虧的好友，甚至不管怎麼虧，他都能保有幽默、好脾氣的態度回應，這也是師生維護感情的獨特方式。
udn2017050711391,https://udn.com//news/story/7269/2447821?from=udn-ch1_breaknews-1-99-news,精通多語 城市科大生勇闖日本飯店實習獨當一面,2017/05/07 11:39,技職生在國際上實習、競賽表現亮眼！城市科大旅館學程大三生郭佳欣去年赴日實習一年，勇敢脫離舒適圈，從基礎功夫學起，從被同事嫌動作慢，到現在已能在飯店的賣場獨當一面，每天以日、英與台語等不同語言應對各國的旅客。郭佳欣很喜歡日本，進到城市科大旅館學程後積極準備日語聽、說、讀、寫等能力，直到大二有機會參與來自日本山梨縣「富士松園飯店」的實習面試，一開始只想試試看，最後靠著日語能力表現被錄取，同一批面試學生中只錄取她一人。從去年7月中旬至今，已經實習近10個月。郭佳欣說，剛到飯店時，先從餐廳外場工作做起，因為業務程序不熟，被同事嫌動作太慢。由於對電腦系統很懼怕，結帳時都要操作POS機(結帳)，整個結算步驟適應了很久，期間如果又遇到大團的旅行團，當導遊一直催促時，緊張到大汗小汗直直落，還好有資深員工從旁協助，才度過難關。郭佳欣說，因為這是第一次離家這麼遠，剛開始很不習慣，帶著一個電鍋，常到超市買食材煮火鍋，以前在台灣從沒有下廚。經歷了國外生活的磨練，她自覺獨立不少，證明了自己以後，她相信未來的挑戰都難不倒自己。另外，台科大不分系學士班學生蘇學羿，父親是大學教授、媽媽是國小校長，典型書香子弟卻對讀書很沒興趣，上課都在睡，在放牛班還吊車尾，直到接觸了木作技藝，才找到人生另一片天，獲選為門窗木工類國手，更為台灣拿下暌違18年的國際技能競賽門窗木工職類金牌。蘇學羿回憶，同學曾和他說：「你國中時都在睡覺，也沒什麼上進心，又這麼懶，竟然會想要用比賽上大學。」他說，當時真的沒有目標、沒有方向，但是人生不斷在變化，因為自己的專長不是讀書，所以只要一找到長處，就會加倍努力，不放棄任何一次能改變自己未來的機會。技職生在國際上實習、競賽表現亮眼！城市科大旅館學程大三生郭佳欣去年赴日實習一年，勇敢脫離舒適圈，從基礎功夫學起，從被同事嫌動作慢，到現在已能在飯店的賣場獨當一面，每天以日、英與台語等不同語言應對各國的旅客。郭佳欣很喜歡日本，進到城市科大旅館學程後積極準備日語聽、說、讀、寫等能力，直到大二有機會參與來自日本山梨縣「富士松園飯店」的實習面試，一開始只想試試看，最後靠著日語能力表現被錄取，同一批面試學生中只錄取她一人。從去年7月中旬至今，已經實習近10個月。郭佳欣說，剛到飯店時，先從餐廳外場工作做起，因為業務程序不熟，被同事嫌動作太慢。由於對電腦系統很懼怕，結帳時都要操作POS機(結帳)，整個結算步驟適應了很久，期間如果又遇到大團的旅行團，當導遊一直催促時，緊張到大汗小汗直直落，還好有資深員工從旁協助，才度過難關。郭佳欣說，因為這是第一次離家這麼遠，剛開始很不習慣，帶著一個電鍋，常到超市買食材煮火鍋，以前在台灣從沒有下廚。經歷了國外生活的磨練，她自覺獨立不少，證明了自己以後，她相信未來的挑戰都難不倒自己。另外，台科大不分系學士班學生蘇學羿，父親是大學教授、媽媽是國小校長，典型書香子弟卻對讀書很沒興趣，上課都在睡，在放牛班還吊車尾，直到接觸了木作技藝，才找到人生另一片天，獲選為門窗木工類國手，更為台灣拿下暌違18年的國際技能競賽門窗木工職類金牌。蘇學羿回憶，同學曾和他說：「你國中時都在睡覺，也沒什麼上進心，又這麼懶，竟然會想要用比賽上大學。」他說，當時真的沒有目標、沒有方向，但是人生不斷在變化，因為自己的專長不是讀書，所以只要一找到長處，就會加倍努力，不放棄任何一次能改變自己未來的機會。
udn2017050711392,https://udn.com//news/story/7270/2447822?from=udn-ch1_breaknews-1-99-news,麥當勞Hello Kitty來了！ 化身超萌寵物,2017/05/07 11:39,最萌教主「Hello Kitty」強勢回歸麥當勞，搶攻寵物萌商機。台灣麥當勞今年再度與Hello Kitty跨界聯名合作，也看準這波寵物陪伴趨勢，特別挑選四款人氣寵物造型，5月8日起全球獨家推出「麥麥幫 萌寵來抱抱」Hello Kitty抱枕。「麥麥幫 萌寵來抱抱」Hello Kitty抱枕共四款造型；5月8日上午11時起，「蜜糖小兔」、「Q寶柴犬」首先登場，5月15日「呆萌法鬥」及「淘氣小金魚」接棒討抱抱！消費者凡購買任一套餐，加價269元即可獲得一款，限量販售，喜愛Hello Kitty的粉絲千萬別錯過！台灣麥當勞行銷部副總裁寇碧茹表示：「台灣麥當勞自1999年首度與Hello Kitty跨界合作，一路打造出許多令人驚喜的經典；繼前兩年『麥麥幫仲夏農場』掀起蒐藏熱潮，單店最快3小時內售罄，今年麥當勞再度與Hello Kitty跨界合作，並結合Hello Kitty與寵物兩大萌元素，推出『麥麥幫 萌寵來抱抱』Hello Kitty抱枕，讓消費者無論在家或是辦公室，隨時都能有Hello Kitty與萌寵物的暖心陪伴，預計將再掀起一波風潮。」2017全新「麥麥幫 萌寵來抱抱」抱枕，全套四款，自5月8日起限量販售或售完為止： 凡於麥當勞餐廳購買任何套餐加價269元，即可獲得「麥麥幫 萌寵來抱抱」抱枕乙個。每份套餐限加購乙個，每人每次消費限加購兩個。單買售價299元。5月8日上午11:00推出：「蜜糖小兔」、「Q寶柴犬」。5月15日上午11:00推出：「呆萌法鬥」、「淘氣小金魚」。最萌教主「Hello Kitty」強勢回歸麥當勞，搶攻寵物萌商機。台灣麥當勞今年再度與Hello Kitty跨界聯名合作，也看準這波寵物陪伴趨勢，特別挑選四款人氣寵物造型，5月8日起全球獨家推出「麥麥幫 萌寵來抱抱」Hello Kitty抱枕。「麥麥幫 萌寵來抱抱」Hello Kitty抱枕共四款造型；5月8日上午11時起，「蜜糖小兔」、「Q寶柴犬」首先登場，5月15日「呆萌法鬥」及「淘氣小金魚」接棒討抱抱！消費者凡購買任一套餐，加價269元即可獲得一款，限量販售，喜愛Hello Kitty的粉絲千萬別錯過！台灣麥當勞行銷部副總裁寇碧茹表示：「台灣麥當勞自1999年首度與Hello Kitty跨界合作，一路打造出許多令人驚喜的經典；繼前兩年『麥麥幫仲夏農場』掀起蒐藏熱潮，單店最快3小時內售罄，今年麥當勞再度與Hello Kitty跨界合作，並結合Hello Kitty與寵物兩大萌元素，推出『麥麥幫 萌寵來抱抱』Hello Kitty抱枕，讓消費者無論在家或是辦公室，隨時都能有Hello Kitty與萌寵物的暖心陪伴，預計將再掀起一波風潮。」2017全新「麥麥幫 萌寵來抱抱」抱枕，全套四款，自5月8日起限量販售或售完為止： 凡於麥當勞餐廳購買任何套餐加價269元，即可獲得「麥麥幫 萌寵來抱抱」抱枕乙個。每份套餐限加購乙個，每人每次消費限加購兩個。單買售價299元。5月8日上午11:00推出：「蜜糖小兔」、「Q寶柴犬」。5月15日上午11:00推出：「呆萌法鬥」、「淘氣小金魚」。
udn2017050711393,https://udn.com//news/story/7270/2447823?from=udn-ch1_breaknews-1-99-news,繼花雕雞泡麵年賣千萬碗 台酒再推「秘密武器」,2017/05/07 11:39,台酒公司花雕雞泡麵一年賣出1000萬碗，預計6月再推出新「秘密武器」搶市，將以獨家料理酒包的乾麵新口味，分別是義式紅醬和白醬，積極搶攻乾麵市場。台酒公司去年營收約750億元，其中菸品營收400億、啤酒220億、酒類商品100億元，而泡麵一年營收僅約6億元，但小兵立大功，成為台酒拓展新南向市場的利器。台酒公司董事長吳容輝說，花雕雞泡麵在台灣泡麵市場的市占率排名第四，次於統一、維力和味丹，但在消費者心中的好吃度排名則是數一數二，目前積極深化「泡麵外交」，計畫先和新加坡當地經銷商合作代工生產，將泡麵銷往澳洲、馬來西亞與馬爾地夫等地，未來不排除自行建廠。台酒泡麵年熱銷150萬箱，旺季日銷近10萬碗，主要是內附獨家料理酒包，其中麻油雞泡麵採用米酒，而花雕雞泡麵、花雕牛泡麵則是採用10年以上的陳年花雕酒。未來若計畫外銷海外，陳年花雕酒庫存量是否會供不應求？吳容輝打包票「絕對不會」，台酒公司持續緊盯花雕酒消耗量，會適時接續生產，維持一定的庫存量。吳容輝表示，6月將推出兩款乾麵，分別是蕃茄口味的「紅酒帕式達」、奶油培根口味的「白酒帕式達」，因消費者在試吃時反應吃乾麵較容易口渴，建議能附有湯包同時增加麵體份量，目前將會內附玉米濃湯和味噌湯兩種湯包，以及料理紅酒包和白酒包，現仍在試吃調整階段，預計最快6月即可上市。台酒紅酒帕式達採用卡本內蘇維濃（Cabernet Sauvignon）紅葡萄酒，搭配蕃茄和肉醬製成紅醬口味，而白酒帕式達採用來自智利的夏多內（Chardonnay）白葡萄酒，搭配煙燻培根及奶油製成白醬，乾麵除了內附調理包外，還附有料理酒包。台酒表示，乾麵吃法相當簡單，可沖泡或快煮，約三分鐘就可吃了。台酒公司花雕雞泡麵一年賣出1000萬碗，預計6月再推出新「秘密武器」搶市，將以獨家料理酒包的乾麵新口味，分別是義式紅醬和白醬，積極搶攻乾麵市場。台酒公司去年營收約750億元，其中菸品營收400億、啤酒220億、酒類商品100億元，而泡麵一年營收僅約6億元，但小兵立大功，成為台酒拓展新南向市場的利器。台酒公司董事長吳容輝說，花雕雞泡麵在台灣泡麵市場的市占率排名第四，次於統一、維力和味丹，但在消費者心中的好吃度排名則是數一數二，目前積極深化「泡麵外交」，計畫先和新加坡當地經銷商合作代工生產，將泡麵銷往澳洲、馬來西亞與馬爾地夫等地，未來不排除自行建廠。台酒泡麵年熱銷150萬箱，旺季日銷近10萬碗，主要是內附獨家料理酒包，其中麻油雞泡麵採用米酒，而花雕雞泡麵、花雕牛泡麵則是採用10年以上的陳年花雕酒。未來若計畫外銷海外，陳年花雕酒庫存量是否會供不應求？吳容輝打包票「絕對不會」，台酒公司持續緊盯花雕酒消耗量，會適時接續生產，維持一定的庫存量。吳容輝表示，6月將推出兩款乾麵，分別是蕃茄口味的「紅酒帕式達」、奶油培根口味的「白酒帕式達」，因消費者在試吃時反應吃乾麵較容易口渴，建議能附有湯包同時增加麵體份量，目前將會內附玉米濃湯和味噌湯兩種湯包，以及料理紅酒包和白酒包，現仍在試吃調整階段，預計最快6月即可上市。台酒紅酒帕式達採用卡本內蘇維濃（Cabernet Sauvignon）紅葡萄酒，搭配蕃茄和肉醬製成紅醬口味，而白酒帕式達採用來自智利的夏多內（Chardonnay）白葡萄酒，搭配煙燻培根及奶油製成白醬，乾麵除了內附調理包外，還附有料理酒包。台酒表示，乾麵吃法相當簡單，可沖泡或快煮，約三分鐘就可吃了。
udn2017050711380,https://udn.com//news/story/11093/2447806?from=udn-ch1_breaknews-1-99-news,洪慈庸提補習班教師用真名 柯文哲贊成,2017/05/07 11:38,才女作家林奕含之死，引發社會關注，時代力量立委洪慈庸提案修法，要求補習班老師必須使用真實姓名。台北市長柯文哲今天大表贊成，「行不改名、坐不改姓」。林奕含之死後續發酵，父母發聲明指其因被補教名師誘姦，導致成陰影，引發各界對補習班教師是否採實名制討論，洪慈庸3日表示，將提案修正「補習及進修教育法」，要求補習班負責人、所有教職員員工須用真實姓名執行業務。柯文哲上午出席第5屆愛天使樂活園遊會，會後受訪時表示，對於補習班採實名制表示贊成，「以前聽說很多學校老師去補習班，就要化名，藝名也可以，實名制也好啊！」柯文哲說，他覺得行不改名、坐不改姓，贊成採實名制。才女作家林奕含之死，引發社會關注，時代力量立委洪慈庸提案修法，要求補習班老師必須使用真實姓名。台北市長柯文哲今天大表贊成，「行不改名、坐不改姓」。林奕含之死後續發酵，父母發聲明指其因被補教名師誘姦，導致成陰影，引發各界對補習班教師是否採實名制討論，洪慈庸3日表示，將提案修正「補習及進修教育法」，要求補習班負責人、所有教職員員工須用真實姓名執行業務。柯文哲上午出席第5屆愛天使樂活園遊會，會後受訪時表示，對於補習班採實名制表示贊成，「以前聽說很多學校老師去補習班，就要化名，藝名也可以，實名制也好啊！」柯文哲說，他覺得行不改名、坐不改姓，贊成採實名制。
udn2017050711381,https://udn.com//news/story/7320/2447818?from=udn-ch1_breaknews-1-99-news,暖警默默守護野百合 遊客融化了,2017/05/07 11:38,東北角以前這個季節野百合開滿山，鼻頭燈塔附近還有個百合谷，但因為人為破壞，美景不再，剩下的只是傳說。鼻頭國小校長陳玉芳想把野百合復育回來，去年帶著師生在校園內種下千株野百合，今年跨出校園，在通往鼻頭燈塔步道上的一里長城種了千株野百合，並在山坡上撒下上萬個野百合種子，最近花開了，遊客驚喜之餘，紛紛停下腳步賞花。陳玉芳說，花開了，小朋友很擔心又被採光，他們發現真的有人想來拔花，只是沒以往那麼明目張瞻，他們工友就發現有被挖起，來不及帶走的花。原本警方支持護花，對採花賊應會有嚇阻作用，沒想到傳出基層抱怨警力有限，不該執行額外的勤務，但她後來去了解，確認不是鼻頭所5位員警有意見，比較釋懷。偏遠地區警察和學校、社區關係很密切，派出所所長蔡政達還把他家中孩子不再看的故事書，整箱送給學校，最近百合花開了，蔡政達等人幾乎天天來巡邏，沒了護花勤務，員警仍自願巡邏護花，更感人。幾位自由行陸客得知百合花是小朋友種的，又看到警察默默守護，直呼好有意義，「我們也一起來保護」，台北市王小姐感動的說，這花有警察守護真不錯，「謝謝警察伯伯」。東北角以前這個季節野百合開滿山，鼻頭燈塔附近還有個百合谷，但因為人為破壞，美景不再，剩下的只是傳說。鼻頭國小校長陳玉芳想把野百合復育回來，去年帶著師生在校園內種下千株野百合，今年跨出校園，在通往鼻頭燈塔步道上的一里長城種了千株野百合，並在山坡上撒下上萬個野百合種子，最近花開了，遊客驚喜之餘，紛紛停下腳步賞花。陳玉芳說，花開了，小朋友很擔心又被採光，他們發現真的有人想來拔花，只是沒以往那麼明目張瞻，他們工友就發現有被挖起，來不及帶走的花。原本警方支持護花，對採花賊應會有嚇阻作用，沒想到傳出基層抱怨警力有限，不該執行額外的勤務，但她後來去了解，確認不是鼻頭所5位員警有意見，比較釋懷。偏遠地區警察和學校、社區關係很密切，派出所所長蔡政達還把他家中孩子不再看的故事書，整箱送給學校，最近百合花開了，蔡政達等人幾乎天天來巡邏，沒了護花勤務，員警仍自願巡邏護花，更感人。幾位自由行陸客得知百合花是小朋友種的，又看到警察默默守護，直呼好有意義，「我們也一起來保護」，台北市王小姐感動的說，這花有警察守護真不錯，「謝謝警察伯伯」。
