news ID,url,title,time,content
apl201706250930001,http://www.appledaily.com.tw/realtimenews/article/local/20170625/1147523/槍擊4死掀治安問題　中壢警方今晨強力掃蕩　,槍擊4死掀治安問題　中壢警方今晨強力掃蕩　,2017/06/25 09:30,桃園市中壢區22日發生竹聯幫份子張峻豪（20歲），持槍殺死3人再自戕的重大治安事件，中壢警分局為強化、穩定轄區治安，今日凌晨實施掃蕩勤務，針對中壢區動員75名警力，規劃6個臨檢點、2個路檢點，進行臨檢及盤查可疑人車。警方同時針對重點KTV、養生館、電子遊藝場、旅館等場所及交通要衝實施全面性臨檢，共逮獲一級毒品案2件3人、二級毒品案12件12人、三級毒品案13件38人、妨害風化案8件24人，還查獲毒品通緝案3件3人、搶奪及竊盜通緝案2件1人、毀損通緝案1件1人、酒駕涉及公共危險罪嫌2件2人，均依法移送。警方說，凌晨在中壢區新生路一家KTV臨檢時，聞到濃濃K煙臭味，當場在一間包廂內的垃圾桶內發現自製加工的捲煙1支，但是包廂內男女6人均否認吸毒，送驗尿液採驗卻皆呈陽性，警方於是將6人全案依毒品罪嫌移送偵辦。（突發中心黎百代／桃園報導）推薦閱讀【惡狼片】少女找父拿鑰匙　慘遭父無良友尾隨性侵【起底片】中壢4死槍擊案　槍手身分曝光【有片】為友慶生變調　酒後鬥毆2人傷【有片】三重夜晚不平靜　兩男中槍送醫1死1命危
apl201706250750001,http://www.appledaily.com.tw/realtimenews/article/local/20170625/1147478/【有片】三重夜晚不平靜　2男遭槍殺釀1死,【有片】三重夜晚不平靜　2男遭槍殺釀1死,2017/06/25 07:50,新北市三重區重新路2段上，今天凌晨近3時許，兩名男子遭到不明人士持刀、開槍襲擊，其中一名男子在受傷後，疑似由朋友開車送往醫院，另一名男子倒臥路旁，被路人發現報案送醫，急救後仍因傷重，於清晨5時許宣告不治。警方接獲報案趕到現場，立即圍上封鎖線，調閱附近監視器查緝兇嫌逃往何處。警方表示，這起槍擊事件，嫌犯疑似有3人以上，受傷的24歲李姓及35歲的羅姓男子，疑似遭到人埋伏襲擊，兩人身上都有刀傷及槍傷，獲報到場時，現場留有數枚彈殼，還有刀械跟信號彈，只剩下李姓男子倒臥路旁，救護人員到場時已無生命跡象，送往醫院後仍急救不治，至於另一名羅姓男子，疑似是由友人開車送往醫院救治，運送的轎車就停在醫院外面，轎車明顯有撞擊痕跡，目前羅男還在急救中，轄區警方已經調閱附近監視器畫面，勢必要將兇嫌緝捕歸案，至於襲擊的原因為何，還有待調查釐清。（突發中心游宗樺／新北報導）推薦閱讀催討30萬反遭埋伏　2男一下車就遭4煞槍殺【惡狼片】少女找父拿鑰匙　慘遭父無良友尾隨性侵【起底片】中壢4死槍擊案　槍手身分曝光
apl201706250515001,http://www.appledaily.com.tw/realtimenews/article/sports/20170625/1147483/曾上大聯盟台將有哪幾位　你記得嗎,曾上大聯盟台將有哪幾位　你記得嗎,2017/06/25 05:15,紅襪今天將內野手林子偉升上大聯盟，使得他成為第13位在大聯盟台灣球員，以下為台灣球員在大聯盟的整理。(羅惠齡／綜合報導)陳金鋒　外野手　道奇　大聯盟第1位台將 初登板時間2002/9/15曹錦輝　投手　　落磯　大聯盟首勝、首安台將　初登板時間2003/7/26王建民　投手　　洋基　台灣首位大聯盟勝投王　初登板時間2005/5/1郭泓志　投手       道奇  大聯盟首轟台將　初登板時間2005/9/3胡金龍  內野手     道奇  初登板時間2007/9/2倪福德  投手        老虎  首位中職轉戰大聯盟台將　初登板時間2009/6/30陳偉殷  投手        金鶯  首位日職轉戰大聯盟台將  初登板時間2012/4/11林哲瑄  外野手    紅襪  初登板時間2012/4/15李振昌  投手       印地安人  初登板時間2013/7/15羅嘉仁  投手      太空人  初登板時間2013/8/1王維中  投手      釀酒人  最年輕大聯盟初登板台將  初登板時間2014/4/15胡智為  投手      光芒    初登板時間2017/4/25林子偉  內野手   紅襪 
cna201706251120001,http://www.cna.com.tw/news/afe/201706250069-1.aspx,威力彩頭獎難飆高 2年未破10億扯風水說,2017/06/25 11:20,（中央社記者田裕斌台北25日電）還記得2015年2次威力彩頭彩超過新台幣25億元引發的全民投注熱潮嗎？但威力彩已經超過2年沒出現過10億元以上頭彩，就有內部員工推測，是不是台彩風水變差了？原本台彩總公司在台北市光復北路及民生東路口的科技服務大樓，由於大樓底下有瑠公圳的大水庫，被認為有「聚財」的作用，台彩也在這裡自2012年起，每年創下超過千億元的業績。只不過，在台彩將總部搬回母公司中信金控位於南港的金融園區後，就好像被「拐氣」般，頭彩往往累積得不夠高就開出，也讓台彩去年業績掉了近15%。根據統計，雖然自第4屆公益彩券開賣起的3年，威力彩每年都開出4次，平均每次槓龜期間延續3個月，其中，2015年間台彩超級好運，威力彩不但在1月8日就迎來1次20.12億元的頭彩，4月23日又開出1次30.03億元的頭彩，9月14日則是開出28.73億元的頭彩，1年出現3次超過20億元的頭彩獎金實屬難得。之所以可以累積高頭彩，與摃龜期數拉長有很大關係，2015年這3次威力彩高頭彩都累積超過3個月，最長還逼近5個月，期間還有台彩針對特殊節慶祭出的加碼，加速頭彩累積；反觀去年威力彩雖一樣開出4次頭彩，但僅3月14日開出的10.56億元頭彩累積約3.5個月，其餘3次頂多滿3個月就開出。只不過，彩迷對於高頭彩也有麻痺跡象，以往只要頭彩獎金超過保證的2億元之後，投注金額就會開始攀高，頭彩約3.5億元的單期投注金額即可逼近1億元，但2015年後得累積到6億元以上，單期投注金額才可能上億元。投注站業者分析，彩迷愈來愈精可能是台彩業績下滑的主因，現在威力彩頭彩沒有5億元以上，會投注的彩迷都是基本盤，無法吸引平常不下注的人，這也難怪今年2月13日威力彩頭彩9.59億元，當期投注額僅2.5億元，5月25日開出威力彩6.07億元，投注金額連1億元都不到。1060625
cna201706251115001,http://www.cna.com.tw/news/aipl/201706250068-1.aspx,警察哥哥吳拱陽粉絲多  執勤還被認出,2017/06/25 11:15,（中央社記者謝佳珍台北25日電）警政署保六總隊第1大隊第4中隊小隊長吳拱陽喜歡唱歌，不僅在台灣參加電視節目歌唱比賽，還遠赴大陸挑戰，粉絲都叫他「警察哥哥」，日前在立法院執行勤務時，還被認出來。吳拱陽原本在內政部長辦公室協助民眾處理被暴力討債案件，去年改調立法院；從小就愛哼哼唱唱的他，常利用公餘時間，征戰大大小小的歌唱比賽。民國82年第一次參加歌唱比賽就奪冠，當時主辦單位北港朝天宮給了5兩重的黃金當獎品，這是吳拱陽最引以為傲的得獎事蹟。4、5年前參加三立「超級紅人榜」歌唱比賽，吳拱陽的好歌喉，擁有不少粉絲，走在路上常被認出來。吳拱陽說，最近有不少團體到立法院抗議年金改革，有一天在立法院大門口執行勤務時，有位阿姨很驚訝的上前問他，「你不是紅人榜的那位嗎？怎麼會在這裡」，阿姨還拿水給他，要他別太勞累，甚至要他以後若參加比賽要記得說，讓他很感動。吳拱陽今年3月遠赴大陸參加海峽兩岸閩南語歌星選拔賽，這是吳拱陽首次征戰海外，從台灣初選近300名參賽者中脫穎而出，取得前5名決賽資格，前往大陸與其他對手一較高下。吳拱陽以指定曲「心愛的甭哭」與自選曲「罔市仔」獲得評審第2名的肯定，不過加計現場觀眾票選，最後獲得第4名。吳拱陽說，雖然成績不是很理想，但也是難得的經驗。不僅參加歌唱比賽，吳拱陽還以歌聲關懷弱勢，有空就會主動聯繫養護機構、療養院等，自掏腰包前往表演，並把獎金捐出做公益。吳拱陽曾獲選警政署警察公益大使、好人好事代表，從民國99年到106年連續7年榮獲內政部所屬機關單位愛心時數前3名，愛唱歌的吳拱陽說，他會繼續以行動回饋社會。1060625
cna201706251114001,http://www.cna.com.tw/news/aipl/201706250067-1.aspx,藝人反亞泥 府：台灣公民社會崛起茁壯,2017/06/25 11:14,（中央社記者呂欣憓台北25日電）昨天的金曲獎頒獎典禮中，不少藝人公開反對亞泥。總統府今表示，表演工作者對公共事務與土地的深刻關懷，象徵台灣公民社會的崛起茁壯，這也是台灣作為成熟民主國家的驕傲。今年金曲獎評審團獎頒給生祥樂隊，昨天晚間的典禮上，主唱林生祥上台致詞時呼籲大家一起上街頭反亞泥；多名藝人走紅毯都拿著「撤銷亞泥」的牌子；擔任金曲開場表演的張震嶽，登台也高舉「沒有人是局外人」呼應。總統府發言人黃重諺表示，台灣是健康多元的民主國家，才有能夠自由呼喊的舞台，台灣的表演工作者不但在藝術上有不凡的潛力與傑出表現，對於國內各項公共事務與土地的深刻關懷，更象徵台灣公民社會的崛起茁壯。黃重諺說，由他們帶動社會有更深的人文關懷、更進一步的土地情感，這也是台灣作為成熟民主國家的驕傲。1060625
cna201706251112001,http://www.cna.com.tw/news/firstnews/201706255006-1.aspx,政大校歌將增訂新歌詞 9月逐句討論,2017/06/25 11:12,（中央社記者許秩維台北25日電）政大校歌爭議不斷，政大校方今天表示，經校務會議討論和投票，決議保留原校歌，但要增訂校歌（新詞），下次校務會議9月7日針對校歌新詞逐句討論。    政治大學校歌歌詞被認為有黨國思想，導致爭議不斷，政大校務會議接受提案，成立「檢討現行校歌委員會」，並開放問卷調查，邀教職員、學生和校友表達意見，調查結果也提供校務會議參考。    「檢討現行校歌委員會」於3月31日至5月31日進行問卷調查，共有2070人表達意見，調查顯示，51.84%同意舊校歌和修訂版歌詞並陳，46.57%反對；同意並陳者中，有30.87%完全接受修訂版歌詞，19.47%部分接受，不同意並陳者中，19.9%認為應另創新校歌，17%認為維持原校歌。    政治大學表示，經校務會議代表表達意見及討論後，「是否贊成保留原校歌？」獲在場所有代表無異議通過，至於「是否同意增訂校歌（新詞）？」，以無記名投票進行表決，共55票贊成、29票反對、1票廢票，通過增訂校歌（新詞）。    政大校方也表示，會中有代表提出「逐句討論增訂校歌新詞」，最後舉手投票進行表決，共37票贊成、33票反對，因此最後決議於下次校務會議（9月7日），針對校歌新詞進行逐句討論。    政大校長周行一表示，校歌具傳承意義，也代表對學校及師生的期許，討論校歌與時俱進，其實很好，不要狹窄為意識形態或政治性議題，而是政大教育自己、教育學生非常好的機會，藉此充分溝通，並尊重多元意見。1060625
cna201706251109001,http://www.cna.com.tw/news/aipl/201706250066-1.aspx,國民黨立委發言表立場 公務員年改牛步,2017/06/25 11:09,（中央社記者王承中台北25日電）立法院朝野黨團因協商破裂在院會處理年改三法。因國民黨逐條發言表達立場，經22、23日兩天，公務員年改草案只二讀完43條，但樓地板、優存及所得替代率等關鍵條文已完成二讀。因國民黨立院黨團在21日朝野協商年改三法時，不滿關鍵條文沒納入在野黨意見，主張在院會直接逐條處理，導致協商破局。於是立法院在22日開院會處理公務人員退休資遣撫卹法草案。在22、23日兩天的院會中，國民黨團在每條條文都派出至少5名立委登記發言，時代力量與親民黨籍立委，則在關鍵條文時登記發言。為讓在野黨充分發言，民進黨團則在最後才提議停止討論。為了加快處理速度，民進黨團在23日提議延長開會時間至深夜12時，但因國民黨籍立委的冗長發言，經過22、23日兩天的表決，總共有93條條文的公務人員退休資遣撫卹法草案，只處理完43條。但如樓地板、育嬰留職停薪、優惠存款及所得替代率等關鍵條文皆已完成二讀。二讀條文明定公務人員年金改革樓地板為新台幣3萬2160元、育嬰留職年資可累計，但費用需自付。退休公務員支領月退休金者，18%優存在2年歸零。 所得替代率部分，二讀條文明定，年資滿15年者，退休的所得替代率為45%，分10年降至30%；年資滿35年者，所得替代率則為75%，分10年降至60%。立法院職權行使法規定，第三讀會，除發現議案內容有互相牴觸，或與憲法、其他法律相牴觸者外，祇得為文字之修正。1060625
cna201706251059001,http://www.cna.com.tw/news/aopl/201706250065-1.aspx,86歲還要選 阿根廷前總統躲坐牢靠這招,2017/06/25 10:59,（中央社布宜諾斯艾利斯24日綜合外電報導）高齡86歲的阿根廷前總統孟年（Carlos Menem）今天宣布參選國會議員，如果他選上，可望讓他躲掉一連串犯罪定讞所帶來的牢獄之災。法新社報導，孟年於1989年到1999年間擔任阿根廷總統，並於2005年起開始出任國會議員，他因為武器非法交易與貪瀆遭到定罪，但由於國會豁免權保障，刑期一直遲遲沒有開始。孟年在推特上宣布他要參與10月大選的消息，一旦他選上，4年任期結束時，他已經91歲。（譯者：中央社許湘欣）1060625
cna201706251055001,http://www.cna.com.tw/news/aipl/201706250064-1.aspx,開齋節  蔡總統臉書影片祝穆斯林快樂,2017/06/25 10:55,（中央社記者呂欣憓台北25日電）今天是伊斯蘭教的開齋節，總統蔡英文今天在臉書上邀請國人一起來感受開齋節的熱鬧歡慶氣息，並祝福所有穆斯林朋友開齋節快樂，同時感謝穆斯林移工對台灣的打拚和付出。蔡總統今天早上在臉書貼文表示，台北清真寺昨天晚上宣布，今天就是開齋節，全世界17億穆斯林教友，完成了近1個月的神聖齋戒。蔡總統說，在伊斯蘭傳統裡面，開齋節是一年當中最值得慶祝的日子，在這一天，穆斯林朋友會到清真寺參加會禮，也會和親朋好友歡聚。
cna201706251045001,http://www.cna.com.tw/news/afe/201706250063-1.aspx,通路為王 農產運銷主動出擊,2017/06/25 10:45,走出菜價魔咒—解析蔬菜產銷制度專題之六（中央社記者林孟汝台北25日電）菜價飆漲、搶種、狂跌的三部曲，幾乎年年上演，產地與市場價格的落差更是菜農心中的痛，在網路興起、返鄉青農增多下，傳統經由盤商行口運銷的方式產生質變，透過產銷班、自組合作社運銷或網路直銷，菜農化被動為主動，以多元運銷擺脫悲情，闖出自己的一片天。運銷系統環節愈多 成本愈高氣候異常成為常態、「菜土菜金」的波動仍大，除了生產結構面的調整，運銷體系的改革也是重點之一。農民受限於財力、採收人力、運送能力不足，以往只能透過大、中、小盤居中轉運，甚至有些經濟狀況不佳的菜農會先拿訂金來當成本，相對菜的訂價也受制於人，菜農變成代工，加上肥料、農藥近幾年翻倍漲，菜農的利潤更微薄了。以高麗菜為例，一般農民沒辦法採收，只能和有倉儲、機器設備、專業採收工班人力的大盤合作，當市場價格崩跌、盤商不缺貨時，如果沒有固定合作的盤商，菜農只能依盤商喊價忍痛賣出，不然就只能落得以一顆10元低價開放高麗菜園供民眾「自採自買」。有菜農就說，「盤商公斤買台斤賣，中間差了40％，都是他們賺走了」，但也有人為盤商說話，菜農子弟「文青別鬼扯」的鬼王劉志偉說，「玩農產品的風險非常大」，蔬果的保存期限非常短，而且非常容易出現損傷、腐敗，從產地到餐桌之間一層又一層的耗損外，蔬果還要確保能馬上賣掉，「有時市場上菜很多，就得壓低售價賠售」，這都是盤商自己要去承擔的買賣風險。心痛拍賣市場將一大堆爛菜送進垃圾場，台大農發中心研究員林弘仁保守估計，葉菜類的耗損約10%至20%，遇到豪大雨又出太陽，還可能還上看30%至50%，這些都計入消費者要從口袋掏出的「成本」，加上紙箱、運費等管銷費用，產銷環節「多了一點」，零售價當然會比產地價高。接受農產品生產者或販運商的委託，在批發市場內，批售青果、蔬菜給零售商，從中賺取利潤的商人，稱為「行口(中盤)」。每天過了午夜之後，裝滿蔬果的卡車陸續駛進果菜批發市場，接棒的行口已經蓄勢待發，準備卸貨、聯絡下游零售商，轉手間的利潤至少一成。但是行口賣的價格和數量對農民來說，數字並不透明，隻手遮天的情形時有所聞，部分行口在蔬菜價格飆漲時，低價收購，高價販售，獲取較高的利潤；在價崩時，行口一定第一個降價，「你不降你去找別人賣，反正很多人要賣」，就算菜農隔天查了交易行情價，但一切都已船過水無痕，被坑最多也只能選擇下次換行口交易。菜農最後一哩路 他助還要自助傳統的運銷方式很有效率，但是也產生很多的問題，透過產地直送，或可協助縮短傳統產銷產生的弊端，尤其近年返鄉耕種的青年增多，加上網路資訊流通迅速，從產地到餐桌，通路不再只有一條。這種情況尤其在農會和合作社的消長最明顯，彰化縣農業處長黃碧海表示，有些農民自組的大型合作社，不需透過盤商就可把農產品送到批發市場，因為機動性強，漸漸取代原本農會或盤商的功能，銷貨管道暢通，產銷價格就不會相差很懸殊。擁有正式社員和贊助社員逾千位農戶的雲林漢光果菜生產合作社就是其中的佼佼者，以契作方式用西螺果菜市場當天價格向農民購買蔬菜，還做足採收後處理、分級、包裝等處理，請工作人員截切、即食加工、行銷、倉儲、配送、網路行銷等，採行全方位一條龍作業模式，菜農更有保障。除了合作社打團體戰，有些農民因環境因素採自產自銷，像彰化縣和美鎮工廠多、土地貴、工人又不好請，務農的少，經濟規模太小，當地菜農葉榮昌說，行口到此收貨的效益不高，加上給小盤(販)的價格都會被要求以南部供貨價結帳，他就和太太上午到傳統市場賣菜，下午和晚上才到田裡工作，菜價不好時，多樣蔬菜可以「抓長補短」，菜價高時，少掉被抽一手的機會，賺錢不是問題。電商平台新鮮宅配  效率仍是重點台灣電商布建完善、金流物流發展快速，農業轉型電商化已成為新興經營趨勢，這幾年在電商平台發光發熱的「阿璋的地瓜」，上架三週即銷售2356斤，占總季銷量達六至七成透過網路販售，不僅少掉中間盤商的利益分配，還能縮短農人和消費者的距離，一炮打響知名度。不過，目前農產品傳統運銷效率還是比電商高，尤其電商仍難以解決倉儲和運送問題，如果只是轉單，沒有顧好品質或準時交貨，很難會帶給民眾好的消費體驗，不僅糾紛恐會層出不窮，平台交易量也會每況愈下，菜農只好又回去傳統產銷模式，再陷菜土菜金的輪迴。農產品運銷最後一哩路除了傳統市場，量販店、合作社、電商平台，甚至便利商店也開始加入戰局，以往只能將收成交給盤商的菜農選項變多，但也更注重經營的眉角及品牌信任度，政府單位要如何化解其中的瓶頸，幫助農夫賺取合理利潤，或許就能引導菜農改採計畫生產的模式，穩定產量，根本解決供需問題。1060625
