news ID,url,title,time,content
udn201706260051000,https://udn.com//news/story/7005/2546319?from=udn-ch1_breaknews-1-99-news,伯明罕女網／海峽組合惜敗 拚戰3盤無緣后冠,2017/06/26 00:51,總獎金88.5萬美元的伯明罕草地公開賽，台灣女將詹皓晴與大陸張帥「海峽組合」在決賽不敵大會第4種子、澳洲組合芭蒂（Ashleigh Barty）／狄拉克（Casey Dellacqua），以1：6、6：2、8：10屈居亞軍。芭蒂／狄拉克合作首冠就是在2013年的伯明罕草地公開賽拿下，加上這一冠，兩人合作已累積5座雙打金盃。詹皓晴上一度闖決賽是法網前和詹詠然在史特拉斯堡「合體」，但雙姝就是不敵芭蒂／狄拉克，屈居亞軍；如今換了搭檔闖進今年第3場決賽，仍無法突破這組澳洲組合。一開賽澳洲組合來勢洶洶，連下5局，只讓詹皓晴組合保發1局，很快就以6：1收下首盤。第2盤海峽組合一改首盤的頹勢，3破對手發球局，將盤數扳平。進入「超級搶10」，澳洲組合在1：3落後時打出一波5：0攻勢，反將戰局逆轉，此後詹皓晴組合只能在後苦追，最終仍無力逆轉。總獎金88.5萬美元的伯明罕草地公開賽，台灣女將詹皓晴與大陸張帥「海峽組合」在決賽不敵大會第4種子、澳洲組合芭蒂（Ashleigh Barty）／狄拉克（Casey Dellacqua），以1：6、6：2、8：10屈居亞軍。芭蒂／狄拉克合作首冠就是在2013年的伯明罕草地公開賽拿下，加上這一冠，兩人合作已累積5座雙打金盃。詹皓晴上一度闖決賽是法網前和詹詠然在史特拉斯堡「合體」，但雙姝就是不敵芭蒂／狄拉克，屈居亞軍；如今換了搭檔闖進今年第3場決賽，仍無法突破這組澳洲組合。一開賽澳洲組合來勢洶洶，連下5局，只讓詹皓晴組合保發1局，很快就以6：1收下首盤。第2盤海峽組合一改首盤的頹勢，3破對手發球局，將盤數扳平。進入「超級搶10」，澳洲組合在1：3落後時打出一波5：0攻勢，反將戰局逆轉，此後詹皓晴組合只能在後苦追，最終仍無力逆轉。
udn201706260045000,https://udn.com//news/story/6809/2546262?from=udn-ch1_breaknews-1-99-news,印屬克什米爾纜車墜地 7死上百人獲救,2017/06/26 00:45,新德里電視台（NDTV）報導，事發時其他15輛纜車上另有約150人受困，但稍後都獲救。戈馬格（Gulmarg）的纜車號稱世界最高，讓乘客由4100公尺高度飽覽白雪覆蓋的喜馬拉雅山美景。警方首長胡笙（Imtiyaz Hussain）表示，有七人在這次事件中喪生。他告訴法新社：「我們還在搜索纜車線下方的森林地帶，看看是否還有更多屍體。」他表示，一棵倒落的松樹擊中一台纜車的纜繩，導致纜車墜落數百尺下的地面。美聯社報導，遇難七人中包括四位印度遊客和三位當地居民，另有四人受傷。戈馬格是動盪不安的克什米爾地區唯一滑雪勝地，即使不是滑雪季，也有遊客前往賞景。新德里電視台（NDTV）報導，事發時其他15輛纜車上另有約150人受困，但稍後都獲救。戈馬格（Gulmarg）的纜車號稱世界最高，讓乘客由4100公尺高度飽覽白雪覆蓋的喜馬拉雅山美景。警方首長胡笙（Imtiyaz Hussain）表示，有七人在這次事件中喪生。他告訴法新社：「我們還在搜索纜車線下方的森林地帶，看看是否還有更多屍體。」他表示，一棵倒落的松樹擊中一台纜車的纜繩，導致纜車墜落數百尺下的地面。美聯社報導，遇難七人中包括四位印度遊客和三位當地居民，另有四人受傷。戈馬格是動盪不安的克什米爾地區唯一滑雪勝地，即使不是滑雪季，也有遊客前往賞景。
udn201706260045001,https://udn.com//news/story/6811/2546317?from=udn-ch1_breaknews-1-99-news,戰後日製造業最慘　高田料申請破產保護　,2017/06/26 00:45,因安全氣囊召回問題深陷困境的日本高田公司計劃最快於26日上午向東京地方法院申請破產保護，預計包含召回費用在內的負債總額超過1兆日元，這將是日本製造業戰後最大破產案。共同社報導，高田力爭在中資美國汽車零件公司的支援下推進重整。16日傳出報導說，高田正在就申請破產保護進行最後協調，東京股市高田的股價隨之大跌。26日為避免股票市場混亂，高田估計將在正常交易時間開始前召開董事會，最終決定申請破產保護，完成相關手續。但是，由於高田此前一直堅持庭外重組，申請時間有可能因準備不足而晚於預期。由各汽車製造商墊付的召回費用高達1兆日元規模，加上截至今年3月底高田約4000億日元的負債總額，將大幅超過2016年11月特別清算的松下子公司松下等離子顯示器（負債5000億日元）等。高田將把健全的安全氣囊和安全帶等業務轉移至分拆的新公司，然後接受中國汽車零件公司旗下美國公司百利得汽車安全系統（KSS）的支援繼續供應產品。因安全氣囊召回問題深陷困境的日本高田公司計劃最快於26日上午向東京地方法院申請破產保護，預計包含召回費用在內的負債總額超過1兆日元，這將是日本製造業戰後最大破產案。共同社報導，高田力爭在中資美國汽車零件公司的支援下推進重整。16日傳出報導說，高田正在就申請破產保護進行最後協調，東京股市高田的股價隨之大跌。26日為避免股票市場混亂，高田估計將在正常交易時間開始前召開董事會，最終決定申請破產保護，完成相關手續。但是，由於高田此前一直堅持庭外重組，申請時間有可能因準備不足而晚於預期。由各汽車製造商墊付的召回費用高達1兆日元規模，加上截至今年3月底高田約4000億日元的負債總額，將大幅超過2016年11月特別清算的松下子公司松下等離子顯示器（負債5000億日元）等。高田將把健全的安全氣囊和安全帶等業務轉移至分拆的新公司，然後接受中國汽車零件公司旗下美國公司百利得汽車安全系統（KSS）的支援繼續供應產品。
udn201706260026000,https://udn.com//news/story/7239/2546312?from=udn-ch1_breaknews-1-99-news,南山產險通過ISO 27001資安驗證,2017/06/26 00:26,為提升金融e化服務及落實資訊安全管理，南山產險表示，已通過由台灣檢驗科技股份有限公司(SGS)認證的「ISO 27001:2013資訊安全管理系統國際標準驗證」，顯示該公司在資訊安全管理及個人資料的控管，已與國際資訊安全標準接軌。南山產險未來除了將持續為客戶打造全方位的資訊安全防護網，７月起也將推出全新網路投保服務，提升民眾購買保險保障的便利性。秉持從客戶角度思考的企業理念，南山產物為強化消費者個人資料安全性，以既有資訊安全政策為基礎，導入ISO 27001:2013認證制度，確保核心業務之運作及資料之機密性、完整性與可用性。南山產險表示，此次驗證範圍為電子商務相關營運系統，將資訊安全管理與國際標準接軌，讓客戶資料更有保障之餘，也順勢推展網路投保，提升金融e化服務。南山產險指出，近年來金融產業資訊服務需求與日俱增，為進一步保障客戶資料，必須藉由全面性的資訊安全管理框架，規劃組織內部的相關管理，並將最新資安趨勢與觀念，融入企業文化中，才更能提供客戶更快速且有效率的服務之餘，對客戶權益做到最完善的保障。為提升金融e化服務及落實資訊安全管理，南山產險表示，已通過由台灣檢驗科技股份有限公司(SGS)認證的「ISO 27001:2013資訊安全管理系統國際標準驗證」，顯示該公司在資訊安全管理及個人資料的控管，已與國際資訊安全標準接軌。南山產險未來除了將持續為客戶打造全方位的資訊安全防護網，７月起也將推出全新網路投保服務，提升民眾購買保險保障的便利性。秉持從客戶角度思考的企業理念，南山產物為強化消費者個人資料安全性，以既有資訊安全政策為基礎，導入ISO 27001:2013認證制度，確保核心業務之運作及資料之機密性、完整性與可用性。南山產險表示，此次驗證範圍為電子商務相關營運系統，將資訊安全管理與國際標準接軌，讓客戶資料更有保障之餘，也順勢推展網路投保，提升金融e化服務。南山產險指出，近年來金融產業資訊服務需求與日俱增，為進一步保障客戶資料，必須藉由全面性的資訊安全管理框架，規劃組織內部的相關管理，並將最新資安趨勢與觀念，融入企業文化中，才更能提供客戶更快速且有效率的服務之餘，對客戶權益做到最完善的保障。
udn201706260026001,https://udn.com//news/story/7239/2546313?from=udn-ch1_breaknews-1-99-news,華南銀行以房養老貸款 集三大優點,2017/06/26 00:26,華南銀行表示，推出新版以房養老貸款方案，結合以房養老、安養信託、即期年金險等三大功能，最低申貸年齡63歲，比一般銀行的方案低了三歲；貸款年息僅1.83%，也比其他銀行年息至少2%以上還要優惠。華南銀行個金行銷部商品規劃科科長敖景川表示，辦理以房養老不動產抵押貸款的民眾，可選擇一次領取核貸金額、或是分期領取，分期領取又分成十年、20年、30年三種。領取的資金須用於特定用途，也就是須購買華銀搭配以房養老的信託與即期年金商品。敖景川說，華銀以房養老貸款方案年息僅1.83%，即期年金保險支付的年金，付完以房養老的融資利息後還有剩餘，可留給家人、或是存起來，作為契約到期後，償還融資本金之用。這項名為「美滿享福貸」的以房養老方案，具備三大優點：一是借款人的房子若因都更、天災等因素而滅失，保險年金仍會繼續給付；二是透過安養信託協助保障生活資金，防止詐騙及不肖子孫覬覦。三是投保時被保險人免體檢、免健康告知，保險公司承保後，無論借款人的健康狀況如何，都會定期給付年金，若貸款到期時借款人仍生存，也會展延貸款到期日來保障年長者的居住權。華銀表示，台北市一名75歲年長者，與已婚的兒子同住其名下一間公寓，手邊亦沒有其他多餘資產，無意間在報紙上看到介紹以房養老貸款的新聞，為了減輕兒子奉養負擔及提升生活品質，即考慮申辦。他向華南銀行詢問後，決定申辦，主要考量透過信託及保險可保障生活資金，且借款期間20年，於第17年左右所領的保險年金給付總額，已超過貸款本金。若於保險期間往生，家人可繼續領取月給付金，子女可使用月給付金作為還款來源，繼續保有不動產，同時減輕經濟負擔。華南銀行表示，推出新版以房養老貸款方案，結合以房養老、安養信託、即期年金險等三大功能，最低申貸年齡63歲，比一般銀行的方案低了三歲；貸款年息僅1.83%，也比其他銀行年息至少2%以上還要優惠。華南銀行個金行銷部商品規劃科科長敖景川表示，辦理以房養老不動產抵押貸款的民眾，可選擇一次領取核貸金額、或是分期領取，分期領取又分成十年、20年、30年三種。領取的資金須用於特定用途，也就是須購買華銀搭配以房養老的信託與即期年金商品。敖景川說，華銀以房養老貸款方案年息僅1.83%，即期年金保險支付的年金，付完以房養老的融資利息後還有剩餘，可留給家人、或是存起來，作為契約到期後，償還融資本金之用。這項名為「美滿享福貸」的以房養老方案，具備三大優點：一是借款人的房子若因都更、天災等因素而滅失，保險年金仍會繼續給付；二是透過安養信託協助保障生活資金，防止詐騙及不肖子孫覬覦。三是投保時被保險人免體檢、免健康告知，保險公司承保後，無論借款人的健康狀況如何，都會定期給付年金，若貸款到期時借款人仍生存，也會展延貸款到期日來保障年長者的居住權。華銀表示，台北市一名75歲年長者，與已婚的兒子同住其名下一間公寓，手邊亦沒有其他多餘資產，無意間在報紙上看到介紹以房養老貸款的新聞，為了減輕兒子奉養負擔及提升生活品質，即考慮申辦。他向華南銀行詢問後，決定申辦，主要考量透過信託及保險可保障生活資金，且借款期間20年，於第17年左右所領的保險年金給付總額，已超過貸款本金。若於保險期間往生，家人可繼續領取月給付金，子女可使用月給付金作為還款來源，繼續保有不動產，同時減輕經濟負擔。
udn201706260026002,https://udn.com//news/story/7239/2546314?from=udn-ch1_breaknews-1-99-news,這張美元保單 年報酬率衝3.29％,2017/06/26 00:26,金融環境瞬息萬變，為讓民眾事先可掌握商品的報酬率，投資型保單流行連結目標到期基金。以美元累積型年金為例，等值新台幣30萬元就可進場，持有六年後解約，平均每年報酬率（IRR）可達3.29%。台灣銀行目前1年期美元定存牌告為年息1.4%；保單IRR達3.29%，意味持有該張保單六年，平均每年報酬率是1年期美元定存的2.35倍。繼台灣人壽推出國內首檔連結目標到期基金的投資型保單後，法國巴黎人壽也宣布，推出連結景順2023目標到期新興主權債券基金的投資型保單，在台灣企銀等11家銀行聯賣，本周五（30日）截止申購，成為國內第二家推出此類保單的公司。法國巴黎人壽表示，少子化、高齡化時代來臨，台灣人對投資風險轉趨謹慎， 紛紛尋找收益穩健的新商品，造就債券型基金大賣。目標到期投資法為升級版的債券投資法，藉由明確的到期時間、期間收取債息、無信用風險情況下持有到期可拿回債券面額，鎖住收益水準。法巴的台外幣變額年金或變額壽險，連結景順2023目標到期新興主權債券基金，6月30日結束申購後，7月18日開始進場投資，70%將配置在主權債及類主權債、30%配置在企業債，債券存續期間均集中在4.5至五年。由於目標到期基金投資的一籃子債券，全都是要持有到期，除非債券發行機構出現信用風險，否則在債券買入後，能有多少報酬已經確定。連結目標到期基金的保單，能給保戶多少報酬，在債券買入時也可以確定。法巴人壽為了搶市，在台灣人壽也有的投資型壽險之外，新增投資型年金，且可供選擇的外幣多達八種。由於投資型年金沒有危險保費，IRR比投資型壽險要高。以美元累積型年金為例，六年後解約，0至70歲被保險人不分男女，IRR均可達3.29%。金融環境瞬息萬變，為讓民眾事先可掌握商品的報酬率，投資型保單流行連結目標到期基金。以美元累積型年金為例，等值新台幣30萬元就可進場，持有六年後解約，平均每年報酬率（IRR）可達3.29%。台灣銀行目前1年期美元定存牌告為年息1.4%；保單IRR達3.29%，意味持有該張保單六年，平均每年報酬率是1年期美元定存的2.35倍。繼台灣人壽推出國內首檔連結目標到期基金的投資型保單後，法國巴黎人壽也宣布，推出連結景順2023目標到期新興主權債券基金的投資型保單，在台灣企銀等11家銀行聯賣，本周五（30日）截止申購，成為國內第二家推出此類保單的公司。法國巴黎人壽表示，少子化、高齡化時代來臨，台灣人對投資風險轉趨謹慎， 紛紛尋找收益穩健的新商品，造就債券型基金大賣。目標到期投資法為升級版的債券投資法，藉由明確的到期時間、期間收取債息、無信用風險情況下持有到期可拿回債券面額，鎖住收益水準。法巴的台外幣變額年金或變額壽險，連結景順2023目標到期新興主權債券基金，6月30日結束申購後，7月18日開始進場投資，70%將配置在主權債及類主權債、30%配置在企業債，債券存續期間均集中在4.5至五年。由於目標到期基金投資的一籃子債券，全都是要持有到期，除非債券發行機構出現信用風險，否則在債券買入後，能有多少報酬已經確定。連結目標到期基金的保單，能給保戶多少報酬，在債券買入時也可以確定。法巴人壽為了搶市，在台灣人壽也有的投資型壽險之外，新增投資型年金，且可供選擇的外幣多達八種。由於投資型年金沒有危險保費，IRR比投資型壽險要高。以美元累積型年金為例，六年後解約，0至70歲被保險人不分男女，IRR均可達3.29%。
udn201706260014000,https://udn.com//news/story/6809/2546308?from=udn-ch1_breaknews-1-99-news,土耳其警方以塑膠彈 驅離同志驕傲遊行,2017/06/26 00:14,法新社報導，土耳其警方25日發射塑膠彈，防止同志維權人士進行連續第三年的伊斯坦堡年度同志驕傲遊行。當局以極右派出言恫嚇為由，表示為「安全考量」，決定對驕傲遊行下達禁令，但驕傲遊行的主辦單位表示遊行將照常在塔克辛廣場舉行。警方25日大舉出動，並朝約40名活躍人士發射塑膠彈，以及逮捕數人，強行驅離試圖遊行的群眾。同性戀在土國並非違法，但恐同性戀仍十分 普遍。總統厄多安否認當局對人民強加傳統宗教價值，表示他奉世俗主義為圭臬。法新社報導，土耳其警方25日發射塑膠彈，防止同志維權人士進行連續第三年的伊斯坦堡年度同志驕傲遊行。當局以極右派出言恫嚇為由，表示為「安全考量」，決定對驕傲遊行下達禁令，但驕傲遊行的主辦單位表示遊行將照常在塔克辛廣場舉行。警方25日大舉出動，並朝約40名活躍人士發射塑膠彈，以及逮捕數人，強行驅離試圖遊行的群眾。同性戀在土國並非違法，但恐同性戀仍十分 普遍。總統厄多安否認當局對人民強加傳統宗教價值，表示他奉世俗主義為圭臬。
udn201706260010000,https://udn.com//news/story/7320/2546307?from=udn-ch1_breaknews-1-99-news,超級任務！150公斤男昏迷 從2樓陽台吊掛送醫,2017/06/26 00:10,嘉義市38歲童姓男子躺在家中2樓臥室床鋪，昨天中午家人叫他起床卻一直叫不醒，因2樓至1樓樓梯間狹小，童男體重約150公斤，搬運困難，消防局出動救助器材車用吊臂從2樓陽台將人吊掛救出，送醫後保住一命。25日中午12時58分，嘉義市消防局接獲民眾報案，指稱延平街一戶民宅內有人身體不適，急需救護車及救助器材車，立即派遣第一分隊救護車前往救護。第一分隊隊員王興墨、許嘉雄、林富山火速趕往報案地點，到達時，發現患者童男躺在家中2樓臥室床舖上，家屬表示，不斷呼喚患者起床卻叫不醒，疑似昏迷。救護人員發現童已無呼吸心跳，救護人員立即實施CPR及使用AED現場電擊。考量童家2樓至1樓樓梯間狹小，童男體重破百難以般運，消防人員同步出動救助器材車用吊臂從2樓陽台，利用吊掛方式順利救出，並持續施行CPR按壓，並將患者送嘉義基督教醫院急救，下午1時57分恢復心跳，成功挽救一條寶貴生命。嘉義市38歲童姓男子躺在家中2樓臥室床鋪，昨天中午家人叫他起床卻一直叫不醒，因2樓至1樓樓梯間狹小，童男體重約150公斤，搬運困難，消防局出動救助器材車用吊臂從2樓陽台將人吊掛救出，送醫後保住一命。25日中午12時58分，嘉義市消防局接獲民眾報案，指稱延平街一戶民宅內有人身體不適，急需救護車及救助器材車，立即派遣第一分隊救護車前往救護。第一分隊隊員王興墨、許嘉雄、林富山火速趕往報案地點，到達時，發現患者童男躺在家中2樓臥室床舖上，家屬表示，不斷呼喚患者起床卻叫不醒，疑似昏迷。救護人員發現童已無呼吸心跳，救護人員立即實施CPR及使用AED現場電擊。考量童家2樓至1樓樓梯間狹小，童男體重破百難以般運，消防人員同步出動救助器材車用吊臂從2樓陽台，利用吊掛方式順利救出，並持續施行CPR按壓，並將患者送嘉義基督教醫院急救，下午1時57分恢復心跳，成功挽救一條寶貴生命。
apl201706260829000,http://www.appledaily.com.tw/realtimenews/article/life/20170626/1147988/一例一休爭議多　蔡英文鬆口「不排除修法」,一例一休爭議多　蔡英文鬆口「不排除修法」,2017/06/26 08:29,總統蔡英文日前邀縣市首長餐敘，黨內對一例一休過於僵化頗多怨言，蔡英文鬆口表示，不排除修法。今日出版的《中國時報》報導，一例一休實施後，爭議不斷，蔡英文日前分批宴邀民進黨立委，希望在立法院臨時會中順利推動前瞻基礎建設條例及年金改革方案，但諸多立委向蔡英文表達，基層抱怨一例一休，希望能夠儘快修法。勞動部長林美珠在會中說明，勞動部預計6月29日召開勞檢說明會，會邀請各縣市勞動主管參與，7月1日後仍會採取「宣傳、輔導、檢查」作法，重大違規才會裁罰。據了解，民進黨內要求修法聲浪不斷，蔡英文總統也不反對修法，但要求先釐清問題。（即時新聞中心／綜合報導）【小編推薦】「小小書房」創辦人：誰讓游擊和寶瓶廝殺？最低月租3.3萬 住豪宅跟周董當鄰居
apl201706260826000,http://www.appledaily.com.tw/realtimenews/article/sports/20170626/1148000/世界盃射箭賽第3站　台灣擊敗南韓摘女團金牌,世界盃射箭賽第3站　台灣擊敗南韓摘女團金牌,2017/06/26 08:26,2017年世界盃射箭賽第3站，今天在美國鹽湖城進行的女子反曲弓團體決賽，台灣派出譚雅婷、雷千瑩、彭家楙，在金牌戰以5比3的比數，擊敗由奧運名將奇甫倍領軍的南韓女子射箭隊，也是繼上海站台灣由魏均珩/譚雅婷獲得混合金牌後，連續2站台灣都有金牌進帳。金牌戰前2局台灣分別以55比52、55比53擊敗南韓拿下4比0的領先，第3局被對手追回2分，關鍵的第4局，前4箭台灣分別射下10、10、9、9的高分，雖然第5箭雷千瑩僅射下8分，但最後登場的彭家楙只要射下8分就可獲勝，最終她也穩穩的拿下8分，讓台灣在第4局以54比54和南韓戰平，並以總比分5比3摘下金牌。總教練倪大智說：「這趟出來比賽，可以發現選手們的信心隨著比賽增加變得更好，尤其是男子隊的成績穩定上升，以往的失誤也減少很多。當然，女子隊的成績向來穩定，這次冠軍戰擊敗南韓也是意料中的事，我們現在已經把南韓打到都會怕我們了，之前4強確定晉級決賽打南韓時，全隊都相當興奮，不是因為要爭金，而是要對南韓！」 除了女子團體奪金外，「台灣箭后」譚雅婷也獲得個人銀牌、魏均珩獲得男子個人銅牌，而譚雅婷和魏均珩聯手，又拿下混合賽銀牌。根據國際射箭總會官網顯示，射箭世界盃今年共有6站，外加一場世界運動會，中國上海是第1站。(黎建忠／綜合報導)
apl201706260825000,http://www.appledaily.com.tw/realtimenews/article/international/20170626/1147997/接住從纜車滑落少女　好心男：接住天使,接住從纜車滑落少女　好心男：接住天使,2017/06/26 08:25,美國紐約州知名的六旗大逃亡主題樂園（Six Flags Great Escape park），24日晚間有一名少女搭乘空中纜車時突然滑落，吊在半空中，引發一陣驚慌，最後是由一對父女成功接住她。其中父親事後受訪，表示「上帝放天使下凡，我們接住了她」。47歲的霍華德（Matthew Howard Sr）告訴當地媒體《Daily Gazette》，一家人買了樂園的季票，經常來玩，事發時他原本帶著家人正要離開樂園，但4歲小女兒海瑟停下腳步和樂園員工一起跳舞。此時他看到不遠處有一雙腿吊在空中纜車外，原以為是乘客腿太長，之後才發現是一名少女整個人懸吊在纜車外。他和21歲大女兒琳恩（Leeann Winchell）急忙上前來到纜車下方，試著安慰女孩，讓她冷靜下來，並保證會接住她。不久後，女孩就從約7公尺空中放手跳下，落在霍華德父女的手臂間，沒有大礙。霍華德笑說：「上帝放天使下凡，而我抓住了她。」21歲的琳恩則說，她事後看網路上流傳的現場影片仍覺得心驚膽跳。　（國際中心／綜合外電報導）相關報導：少女搭遊樂園纜車險墜地　「人肉安全網」接住 
