news ID,url,title,time,content
udn201706260000000,https://udn.com//news/story/7270/2545604?from=udn-ch1_breaknews-1-99-news,專訪／吳森基 會呼吸的房子 五感空間的生活紓壓,2017/06/26 00:00,整面的落地窗收攏在兩側，觀音山躍入眼前，還來不及讚歎，一陣輕風吹得人舒服地閉上了眼睛，主人先送上了自家有機廊道種的薄荷水，訪問這才開始。擺張椅子，坐在戶外大陽台上，人進入了窗框框住的自然畫作之中，和築開發總經理吳森基說：「這就是無用之用的空間。」在講究坪效的現代，如此無用的空間卻有療癒的大效，「會呼吸的房子，就能紓解身心。」吳森基說：「我們對家的定義不是house，而是home，希望回到家是能紓壓放鬆、愉悅感官，可以用本心和家人相處。」其中一個重要條件是，房子要能呼吸。找到基地，接著就架設氣象站觀察四季變化，配合內部需求，「讓房子深呼吸、淺呼吸、微呼吸和透氣」，簡單說，就是讓房子能隨著節氣做調整，冬天防寒但要透氣，夏天就可以深呼吸。除了「吸」，也就是引風入室之外，還要考慮「呼」的空間，例如廚房和廁所要放在下風處、或者有機械輔助通風的位置，房子要設計通風路徑，讓濁氣不會回流。「開窗不等於通風、通風不等於對流、對流不等於循環。」吳森基有這麼一句口訣，外呼吸是風力通風、內呼吸是風力通路，把風導入室內，再設計通風路徑，房子的每一個通氣孔，例如門和窗，都希望能對角，這樣風才能一進一出、才能每個角落都有一個微循環，這才是完整的「會呼吸的房子」。十多年前，吳森基在創立公司時，就設定了這樣的理念。但其實更早之前的一次震撼體驗，就種下了「會呼吸的房子」這顆種子。20年前，他們在台北市仁愛路的巷子裡有個建案，事前到國外去做一些體驗參考。吳森基住在一處villa，是位於山坡上的高腳屋，三面通風，他洗完澡出來，躺在那裡，「那是從沒有體驗過的愉悅感，毛細孔在呼吸、身體整個在抒發。我就決定，要讓我的房子有風進來。」那個建案就做成主臥兩向通風、浴室也是兩向通風，地下室更費心，做一面水牆讓水流下，另一面做通風口，所以車子開進來的時候，空間就能產生呼吸的效果，不需要鼓風機。「這是『會呼吸的房子』的原發點。」吳森基念念不忘那樣的愉悅感：「就是風進到室內，身體感覺到風的撫摸、寒毛波動，最後導引出五感的紓壓。」吳森基自然有過不斷熬夜工作的過程，承受後遺症，「所以有機緣做健康的建築，發現生活方式才是關鍵，我逐漸把健康、氣血調整回來。因為做了健康建築，我脫離了缺氧的狀態和環境，我也是受益者。」從「會呼吸的房子」擴大到「節氣建築」、「五感空間」，再到「療癒系建築」，都基於「自然的住」這個原則。吳森基試圖讓休閒感進入室內，不然在快速文明下，每個人都是玻璃情緒、無法平衡，「這就是療癒系建築的主軸，自然是沒有後遺症的，我們希望家是一個能活絡副交感神經的場域，可以傾聽自己的聲音、可以和家人交流。」這裡挖出的石、土、樹，都會留下來做景觀，對環境最小的破壞，還設了一個有機小農場。公共設施如讀書室、會議室、健身房、游泳池、芳療室、蒸氣室都有，難得的是都可以開窗戶再加電風扇，自然的最好。還有一處蔬食餐廳與有機蔬食店，可以做節氣飲食。再來就是令客人驚艷的宴會廳，落地窗全打開後，視野開闊，有住戶會借這裡請私廚宴客，未來計畫供應社區早餐。吳森基說，外面有景觀不難，最難的是從室內看也很美，把景觀收進來，讓人坐下來安定之後享受景觀：右邊可直達三芝的海面，左邊可看台北101，而山在前方，還會隨四季變化，白天的風從海面上來、晚上的風從國家公園下來。移步到實品屋，同樣搶眼的是內縮的陽台，顛覆了一般盡量外推爭取空間的邏輯，風還是在屋內流動，陽台的躺椅帶來休閒氣氛，屋內的「發呆床」更是療癒必備。雖然這條路走了10多年，吳森基承認很辛苦，大多數人會希望家裡氣派一點、金碧輝煌一點，才能彰顯財富，不然好像錦衣夜行。但他覺得那樣的室內空間很難靜心。吳森基說，做這件事，要敢堅持、敢偏執，不計商業的代價跟毀譽，「很多高檔的飯店，例如安曼，也是這麼做，你知道那是對的，但是很少人將之轉換成住宅。我們也許小眾、不夠主流，但只要能連結到小眾就夠了。」和築主客層約45至60歲間，吳森基分析，這些人對自己身心壓力有覺察，喜歡自然、更有人文素養，可能也和他過去一樣，在職場上拚，不懂得平衡和休息，身體曾發生狀況。所以他未來的目標很遠大，希望讓人們能夠理解慢性病，透過建築帶來健康和快樂，「在快速緊張的環境，除了金碧輝煌外，重要的是身心安頓，生生不息。這是我們對於建築、對於家的概念。」吳森基懂安頓身心之道，對茶也有研究，「茶，就是人在草木間，本身就是自然的，藉由茶去體會不同的風土、做茶人的態度。」他說：「茶，也是覺察的察，安靜放鬆去感受茶滋味，不同的溫度、濃度、間隔，是身體五感的學習，透過喝茶和自己對話。」理解這些，就是一個品味，也就是知道自己要什麼、不要什麼，而他，當然是有機、生態野放或自然農法。吳森基連喝茶都有節氣之道，配合身體、年齡和季節有不同選擇。早上可以喝點寒性的東西，所以喝高山茶，主要是綠茶；晚上要安神，所以喝溫潤的熟茶，主要是鐵觀音或烏龍；夏季喜歡清涼有香氣的、秋冬就喝讓身體行氣的茶。整面的落地窗收攏在兩側，觀音山躍入眼前，還來不及讚歎，一陣輕風吹得人舒服地閉上了眼睛，主人先送上了自家有機廊道種的薄荷水，訪問這才開始。擺張椅子，坐在戶外大陽台上，人進入了窗框框住的自然畫作之中，和築開發總經理吳森基說：「這就是無用之用的空間。」在講究坪效的現代，如此無用的空間卻有療癒的大效，「會呼吸的房子，就能紓解身心。」吳森基說：「我們對家的定義不是house，而是home，希望回到家是能紓壓放鬆、愉悅感官，可以用本心和家人相處。」其中一個重要條件是，房子要能呼吸。找到基地，接著就架設氣象站觀察四季變化，配合內部需求，「讓房子深呼吸、淺呼吸、微呼吸和透氣」，簡單說，就是讓房子能隨著節氣做調整，冬天防寒但要透氣，夏天就可以深呼吸。除了「吸」，也就是引風入室之外，還要考慮「呼」的空間，例如廚房和廁所要放在下風處、或者有機械輔助通風的位置，房子要設計通風路徑，讓濁氣不會回流。「開窗不等於通風、通風不等於對流、對流不等於循環。」吳森基有這麼一句口訣，外呼吸是風力通風、內呼吸是風力通路，把風導入室內，再設計通風路徑，房子的每一個通氣孔，例如門和窗，都希望能對角，這樣風才能一進一出、才能每個角落都有一個微循環，這才是完整的「會呼吸的房子」。十多年前，吳森基在創立公司時，就設定了這樣的理念。但其實更早之前的一次震撼體驗，就種下了「會呼吸的房子」這顆種子。20年前，他們在台北市仁愛路的巷子裡有個建案，事前到國外去做一些體驗參考。吳森基住在一處villa，是位於山坡上的高腳屋，三面通風，他洗完澡出來，躺在那裡，「那是從沒有體驗過的愉悅感，毛細孔在呼吸、身體整個在抒發。我就決定，要讓我的房子有風進來。」那個建案就做成主臥兩向通風、浴室也是兩向通風，地下室更費心，做一面水牆讓水流下，另一面做通風口，所以車子開進來的時候，空間就能產生呼吸的效果，不需要鼓風機。「這是『會呼吸的房子』的原發點。」吳森基念念不忘那樣的愉悅感：「就是風進到室內，身體感覺到風的撫摸、寒毛波動，最後導引出五感的紓壓。」吳森基自然有過不斷熬夜工作的過程，承受後遺症，「所以有機緣做健康的建築，發現生活方式才是關鍵，我逐漸把健康、氣血調整回來。因為做了健康建築，我脫離了缺氧的狀態和環境，我也是受益者。」從「會呼吸的房子」擴大到「節氣建築」、「五感空間」，再到「療癒系建築」，都基於「自然的住」這個原則。吳森基試圖讓休閒感進入室內，不然在快速文明下，每個人都是玻璃情緒、無法平衡，「這就是療癒系建築的主軸，自然是沒有後遺症的，我們希望家是一個能活絡副交感神經的場域，可以傾聽自己的聲音、可以和家人交流。」這裡挖出的石、土、樹，都會留下來做景觀，對環境最小的破壞，還設了一個有機小農場。公共設施如讀書室、會議室、健身房、游泳池、芳療室、蒸氣室都有，難得的是都可以開窗戶再加電風扇，自然的最好。還有一處蔬食餐廳與有機蔬食店，可以做節氣飲食。再來就是令客人驚艷的宴會廳，落地窗全打開後，視野開闊，有住戶會借這裡請私廚宴客，未來計畫供應社區早餐。吳森基說，外面有景觀不難，最難的是從室內看也很美，把景觀收進來，讓人坐下來安定之後享受景觀：右邊可直達三芝的海面，左邊可看台北101，而山在前方，還會隨四季變化，白天的風從海面上來、晚上的風從國家公園下來。移步到實品屋，同樣搶眼的是內縮的陽台，顛覆了一般盡量外推爭取空間的邏輯，風還是在屋內流動，陽台的躺椅帶來休閒氣氛，屋內的「發呆床」更是療癒必備。雖然這條路走了10多年，吳森基承認很辛苦，大多數人會希望家裡氣派一點、金碧輝煌一點，才能彰顯財富，不然好像錦衣夜行。但他覺得那樣的室內空間很難靜心。吳森基說，做這件事，要敢堅持、敢偏執，不計商業的代價跟毀譽，「很多高檔的飯店，例如安曼，也是這麼做，你知道那是對的，但是很少人將之轉換成住宅。我們也許小眾、不夠主流，但只要能連結到小眾就夠了。」和築主客層約45至60歲間，吳森基分析，這些人對自己身心壓力有覺察，喜歡自然、更有人文素養，可能也和他過去一樣，在職場上拚，不懂得平衡和休息，身體曾發生狀況。所以他未來的目標很遠大，希望讓人們能夠理解慢性病，透過建築帶來健康和快樂，「在快速緊張的環境，除了金碧輝煌外，重要的是身心安頓，生生不息。這是我們對於建築、對於家的概念。」吳森基懂安頓身心之道，對茶也有研究，「茶，就是人在草木間，本身就是自然的，藉由茶去體會不同的風土、做茶人的態度。」他說：「茶，也是覺察的察，安靜放鬆去感受茶滋味，不同的溫度、濃度、間隔，是身體五感的學習，透過喝茶和自己對話。」理解這些，就是一個品味，也就是知道自己要什麼、不要什麼，而他，當然是有機、生態野放或自然農法。吳森基連喝茶都有節氣之道，配合身體、年齡和季節有不同選擇。早上可以喝點寒性的東西，所以喝高山茶，主要是綠茶；晚上要安神，所以喝溫潤的熟茶，主要是鐵觀音或烏龍；夏季喜歡清涼有香氣的、秋冬就喝讓身體行氣的茶。
apl201706260854000,http://www.appledaily.com.tw/realtimenews/article/international/20170626/1148009/嫩媽忙著傳手機訊息　半歲女嬰淹死浴缸,嫩媽忙著傳手機訊息　半歲女嬰淹死浴缸,2017/06/26 08:54,美國德州一名21歲媽媽因為忙著傳臉書訊息，把6個月大的女兒忘在仍在放水的浴缸中，導致女嬰溺斃。當地警方表示，將控告母親傷害兒童罪名。《紐約郵報》報導，德州帕克郡警方表示，21歲母親夏恩（Cheyenne Summer Stuckey）向警方表示，本月13日她將6個月大女兒賽拉（Zayla Hernandez）放進仍在放水的浴缸之後，女兒在浴室「獨處才短短幾分鐘而已」，等她再回到浴室查看，就發現女兒臉部朝下漂浮在浴缸裏，緊急報警並為女兒進行心肺復甦法急救，但女嬰送醫搶救無效死亡。法醫驗屍報告顯示，女嬰死因是溺斃。夏恩向警方表示，把女嬰獨自留在浴室，是因為忙著照顧另一個兩歲孩子，分身乏術，後來又有鄰居傳來臉書訊息，指控她偷竊一個裝著250美元（約7500元台幣）首飾的包裹，她忙於澄清，才一時疏忽忘了寶寶還在浴缸裏。不過，警方調查夏恩手機內的Facebook Messenger程式使用紀錄，發現案發當天她在女嬰獨留浴室的同一時間，其實是在臉書與兩名網友傳送訊息，前後歷時約18分鐘之久，並不是「短短幾分鐘而已」。警方調查發現，夏恩當時除了透過臉書訊息與鄰居討論包裹的事，也和另一名網友討論毒品的事。案發後夏恩的其他3名子女已被社工人員帶走，安置在寄養家庭。警方指出，夏恩有疏忽照料子女的先例，她的孩子之前曾被安置到寄養家庭，直到上月才回家。　（國際中心／綜合外電報導）推薦新聞：兩幼兒玩鬧不肯下車　被媽媽關車內熱死 
apl201706260853000,http://www.appledaily.com.tw/realtimenews/article/entertainment/20170626/1148006/女兒這麼貼心！　宋達民向妻喊話：再生1個,女兒這麼貼心！　宋達民向妻喊話：再生1個,2017/06/26 08:53,女兒貼心又懂事，宋達民向老婆洪百榕喊話，「我希望百榕給我再生一個女兒」。宋達民在臉書粉絲專頁上傳3張照片，女兒幫忙做家事，洗碗、摺衣服，與躺在客廳滑平板的兒子形成強烈對比。宋達民說，貼心女兒擔心媽媽太累，囊括所有家事，頗有乃父之風，「但回頭看看兒子.....好像完全不關他的事...我希望百榕給我再生一個女兒...」，最後還附上眼冒愛心的表情符號。許多網友留言：「寶妹真的好乖唷～還是女兒貼心，兒子也不錯啦但是小寶哥也看太認真了」、「強烈的對比」、「寶妹，好棒喔～真是體貼，懂事」、「我家也是這樣，哥哥完全沒他的事⋯⋯妹妹就會幫忙做家事」、「女兒就是貼心兒子就⋯⋯⋯」。（即時新聞中心／綜合報導）【小編推薦】「小小書房」創辦人：誰讓游擊和寶瓶廝殺？最低月租3.3萬 住豪宅跟周董當鄰居
apl201706260839000,http://www.appledaily.com.tw/realtimenews/article/sports/20170626/1148007/一朗傳奇添新頁　史上最年長先發中外野手,一朗傳奇添新頁　史上最年長先發中外野手,2017/06/26 08:39,馬林魚在今天對小熊之戰，將鈴木一朗排進先發名單，擔任開路先鋒中外野手，這讓他成為大聯盟自1900年以來，最年長的先發中外野手。一朗今天是43歲又246天，原紀錄是大聯盟歷史盜壘王韓德森(Rickey Henderson)在2002年7月25日的43歲又211天，當年韓德森已效力紅襪，而所謂的1900年以後，也被稱為「現代棒球」，由於19世紀的美國棒球資料並不齊全，因此現代棒球的紀錄，往往就被認定為大聯盟歷史紀錄。不過，馬林魚總教練馬丁利(Don Mattingly)在將鈴木一朗寫進先發名單時，並沒有考慮到紀錄的事，還說：「真的嗎？」在進一步談到做這項調度的想法時，他說：「我只想到，我們有個40幾歲的傢伙在中外野，但他一點都不像40幾歲的人，不管跑壘還是傳球都還是很棒。」只是一朗今天沒打好，4打數都沒敲安打，打擊率下降到2成，不過他在1局曾靠著失誤上壘，最後跑回馬林魚第一分，馬林魚就以4比2獲勝。這比賽是他本季第10場先發，讓外野大將葉立奇(Christian Yelich)可以休息一天，一朗前次先發是6月12日，取代前一天遭球吻的史坦頓(Giancarlo Stanton)，其實馬丁利可以讓歐蘇那(Marcell Ozuna)從左外野移防到中外野，但馬丁利說：「我知道一朗的右外野守備要比中外野好，但我們從不畏懼將他排進外野的任何一個位置。」(謝岱穎／綜合報導)
apl201706260834000,http://www.appledaily.com.tw/realtimenews/article/property/20170626/1140827/房子被賣　新房東重簽約亂開條件,房子被賣　新房東重簽約亂開條件,2017/06/26 08:34,租屋合約寫明「房屋若轉售，在租期租金不變原則之下，承租方須重新簽約」，難道轉售後租賃物、修繕責任，只能由新房東隨意開條件嗎？包租公律師蔡志雄表示，這個租約附註的條文，乍看似乎排除「買賣不破租賃」的規定，但是它寫的並不完整，一來沒有明訂重新簽約失敗該怎麼辦；二來租約僅能規範房客與舊屋主，牽扯到未在原合約簽名的新屋主要與房客重簽約是無效的，所以可以主張特約無效回歸到「買賣不破租賃」，不必簽新約，讀者也就不用擔心原租處物品、修繕責任等，只能由新房東隨意開條件。（陳宥里／綜合報導）【想知道更多，一定要看……】買房問蘋果，有問必答等你問  來來來！你來問！房地產大小事幫你解答：dr@appledaily.com.tw更多房市快訊請看蘋果地產王粉絲團
apl201706260832000,http://www.appledaily.com.tw/realtimenews/article/life/20170626/1148002/關於出版破局　【全文】林奕含曾寫下461字,關於出版破局　【全文】林奕含曾寫下461字,2017/06/26 08:32,才女作家林奕含事件餘波盪漾，除了她本身是否遭到名師誘姦，關於《房思琪的初戀樂園》一書竟也扯出「出版風波」！《房思琪的初戀樂園》是由「游擊文化」於2017年2月出版，而之前，林奕含也曾接觸其他家出版社，她曾於臉書寫下461字訴說「當初談好的合作破了」，特全文登刊如下。（即時新聞中心／綜合報導）林奕含於2016.08.29臉書發文當初談好的合作破了。她說我會受不了出版後的壓力。我很想跟她說：請妳以後不要隨便對別人說「妳什麼都可以告訴我」因為有白癡真的會就這樣相信，比如我其實她檯面下有什麼更骯髒的理由 我都無所謂但我生平最恨的就是因病史而謂我不能說因為妳精神病所以不能出版這就是歧視又一次看到歧視可以多麼落落大方好心，好意，思無邪。媽媽教我要放下我曾經有選擇我可以假裝世界上沒有人以強姦小女孩為樂假裝世界上只有馬卡龍、手沖咖啡和進口文具但是我選擇立根並在毒瘴汙潦的土壤裡過一生曾經我也只是整齊齊頭得像綠紋稿紙的秧苗中的一枝但是我的一生就那樣被改變了妳懂嗎? 我比任何人都不甘心就像我已經忘記八月十一日是什麼日子但是那日一早起床就開始癲癇、流眼淚我不是生來就有癲癇的。可以忘記創傷，可是創傷不會忘了我。沒有她所謂的文壇超新星美少女華麗拋物線旋轉出場了沒有信義誠品一百五十人的簽書會了(但我要的不是這個)(妳懂嗎?)(我只是希望有人能看到我看到的東西)但文章還是要寫的書還是要出的只是書不會放在書店門口它也許會被放在書店店員的嘴巴裡我的書跟我一樣，運氣不好呵。大家都在看【獨家直擊】30歲歌王被向太認兒子　威風買3500萬勞斯萊斯【驚魂片】「鬼嬰」與兒子同睡　拍得到卻看不見 
apl201706260830000,http://www.appledaily.com.tw/realtimenews/article/local/20170626/1143539/【塵爆2周年】復健再痛也要做　豆腐千金民宿夢更近了,【塵爆2周年】復健再痛也要做　豆腐千金民宿夢更近了,2017/06/26 08:30,「最感謝的是一直陪伴的家人和復健師！」陳依欣（25歲）2年前與國小好友參加八仙樂園的彩色派對，不料粉塵爆燃，造成百分之70燒燙傷，從那一天起，陳依欣兩年來都在醫院及重建中心度過。剛進行完鼻子重建手術的陳依欣，頭戴著黑色鴨舌帽，帽緣邊露出一層白色的紗布，面對兩年來辛苦的復健，她不但不氣餒，反而充滿鬥志地說「為了自己再痛也要做！」 來自花蓮的陳依欣出生於一間手工豆腐店，但她小時候沒有和爸爸學做豆腐，反倒跟著朋友到處亂跑，體驗不同的生活，相較於從小顧家的妹妹，她笑稱「自己是比較愛玩的那個」。但也因為常常不在家，陳依欣之前和家人關係疏離，回憶小時候和家人相處的過程，她說「之前和家人關係比較不好，覺得家人比較疼妹妹」。 但心中不平衡的感覺在受傷後有了轉變，陳依欣的家人為了就近陪她復健，停下花蓮的豆腐工作，暫住在新北親戚家，每天從早到晚陪著她完成課程，原本疏遠的妹妹在受傷後也常常供她「使喚」，幫她跑腿買最愛的甜食，這樣的轉折也讓她體悟到家人才是不顧一切，一直陪伴在自己身邊的人，她說「就像朋友平常和你很好，但並不是每一個人都有時間陪你，就只有家人會無條件陪在你身邊」。 在經歷2年的治療後，陳依欣現在漸漸習慣復健的疼痛，怕痛的她一開始總是會在重建中心「鬼吼鬼叫」，但現在重建中心漸漸少了陳依欣喊痛的聲音，反倒是多了些自我激勵的話語。「我爸常說越痛才會好，為了自己再痛也要做」陳依欣一邊拉著彈力帶，一邊說起兩年的治療歷程，她對自己要求嚴格，對任何復健項目總是全力以赴。 為了讓結痂的皮膚增加延展性，職能復健師拿著彈力帶將陳依欣的左膝蓋固定，一邊拿著測量器量著右膝彎曲的角度，陳依欣再也忍不住疤痕撕裂的痛，屈身尖叫，復健師安慰她說「130度，有進步了！」。但自我要求嚴格的陳依欣對這個數字不太滿意，覺得還能更好，但由於先前練跆拳留下的運動傷害，讓她的右膝復原情況不如左膝的好，她說「沒有燒傷之前都不會覺得怎樣，但燒傷之後一下子什麼問題都跑出來」 嚴重的燒燙傷不僅讓陳依欣明白身體的脆弱，更讓她的夢想轉了個大彎。高三那年，陳依欣放棄自己熱愛的跆拳道，進入大漢科技大學運動休閒系就讀，卻沒想到該系規定要主修游泳才能畢業，讓不諳水性的陳依欣「我是連游自由式都會溺水的人，後來大二就休學了！」 休學的陳依欣開始想自己的下一步，與小孩親近的陳依欣決定報考保母證照，在發生八仙塵暴前，她已經完成訓練課程，準備考完試後就開始幫忙朋友帶小孩，但在燒燙傷後，朋友帶著小孩來探望她，她卻連小孩都抱不動。 雖然沒辦法完成保母的夢想，喜愛旅遊的陳依欣在康復後，想要回花蓮開一間有豆腐DIY課程的民宿，不僅完成她受傷前的夢想，同時也能讓爸爸的豆腐工作繼續下去，面對未知的將來，陳依欣不再害怕，她露出笑容堅定地說「無論再痛也都要好好活下去！」 （突發中心楊湘琳、施昂強、黃楷棟／新北報導）陳依欣小檔案 年齡：25歲學歷：花蓮四維高中畢業，因跆拳道成績優異，保送大漢技術學院休閒與運動管理系，大二休學傷勢：全身百分之70燒傷手術：高雄長庚14次、花蓮慈濟4次、林口長庚4次，目前正進行臉部重建手術夢想：回花蓮開豆腐DIY民宿最想說的一句話：為了自己，再痛也要做！ 資料來源：《蘋果》採訪整理
