Title,Time,Content
桃園想新建焚化爐 環委民眾憂戴奧辛問題決議補充資料再審,2017-05-02 18:14,桃園市焚化廠去年底大火，險些引爆垃圾危機，如今恢復燃燒5個月來，雖已清運暫置垃圾2.7萬噸，但焚化廠5月輪流歲修，恐再面臨垃圾危機，桃園市政府決定在桃園環保科技園區再建一座焚化爐，今（2）日在環保署進行環差分析審查會議，盼能盡快解決桃園的垃圾問題，不過戴奧辛的排放和監測問題，讓環評委員和旁聽民眾都很擔憂，要求補充資料後，到專案小組再審。桃園市環保局長沈志修日前接受媒體採訪時說，桃園將推動新建1座桃園市生質能源中心，希望下半年順利發包施工、最快2020年完工營運，解決垃圾問題，今天在環保署進行「桃園科技工業園區」環差變更案的審查，焚化廠預定地約4.38公頃，包括焚化廠、廚餘厭氧發酵發電及底渣掩埋廠，具備三合一功能，該計畫將採BOT（公辦民營）方式招標經營，將原本規劃處理一般事業及有害廢棄物的焚化爐，擴大為一併處理家用垃圾的焚化爐，每天處理量由300噸增加為600噸。不過前來旁聽的時代力量苗栗黨部陳琪忠表示，他不反對蓋焚化爐，但對於政府一直要「偷偷摸摸來」的作法感到十分不滿，他質疑，難道要等到公聽會才讓當地民眾知道要蓋焚化爐，而且焚化爐之所以會到處被反對，就是因為各種污染問題不斷，包括最令人擔憂的戴奧辛問題。陳琪忠說，環保署曾提出焚化爐並非不夠，只是垃圾調度的問題，在去年《廢棄物清理法》通過時，也制訂相關調度辦法，這段時間應該暫緩焚化爐的興建，不然不符合公共利益的原則，未來也會面對當地民眾的抗爭反對。沈志修則表示，相較於其他六都，桃園目前只有一座焚化爐，去年很努力做垃圾減量，減少了7%，也將一週收六天減少為一週五天，焚化爐擺在哪裡大家都會反對，但應該要面對垃圾必須要處理的問題，「除非大家都不要製造垃圾」，現在要再興建一座新的焚化爐，已經和當地的兩位議員、里長都有溝通過，並非完全沒和民眾溝通，之後也會再到地方舉辦說明會。不過環評委員認為，戴奧辛是現在社會大眾最擔憂的問題，開發單位提出採桃園農工的監測數據，和焚化爐間的距離真的太遠 ，應該到濱海地區做才對，且也應該趁此機會考量實施垃圾隨袋徵收，達到垃圾減量，也要加強垃圾分類，少燒塑膠就可以減少戴奧辛排放的機率。環委最後決議，雖然此案已通過環評，但由於規劃變動較大，應補充戴奧辛的背景監測數值提出後續監測規劃，以及垃圾從源頭分類減量的可能性，並補充環境監控管理機制，提出飛灰及底渣資源化再利用可能性，並說明變更後固化掩埋場的設計規劃、容量、用地範圍及收受處理對象等資料後，到專案小組會議再審。
小心！毒草就在你身邊,2017-05-02 18:14,我對菊科植物很有好感，不止因為陶淵明的「採菊東籬下」，還因為我喜歡茼蒿的味道。我去山產店還找山茼蒿、昭和草、飛機菜，其實它們是同一種野菜。有人在fb上，看了我寫的「不知名的小草？」，跟我說：你應該寫一篇「銀膠菊」的厲害，等我上網之後，才知道事態的嚴重。銀膠菊原產於美國南部、墨西哥、西印度群島及南美洲。1988年，被中研院生物多樣性研究中心發現，現在已經由台灣南部向北蔓延，常見於西濱及荒廢地，甚至連新竹、花蓮、台東也發現它們的蹤跡，而金門更是滿山遍野。她們不僅水平擴散，而且垂直向上，蔓延到海拔925公尺的南投仁愛鄉。也許因為她們開著許多白色的小花，葉型又像民間常用的艾草，花朵又像園藝常見的花材滿天星，白花綠葉的模樣甚為討喜，人們就因此帶回家種植觀賞，成為生態危機的幫凶。但是銀膠菊卻是「世界一百種惡性外來入侵種」名錄上的毒草！它們全株有毒，釋出的花粉會引起人體過敏、接觸性皮膚炎、慢性濕疹等；也會導致動物急性中毒，動物死亡解剖檢驗後，發現消化道潰瘍及肝、腎病理變化。銀膠菊是一種強勢生長的雜草，既要耗費社會資源去清除，而且是有毒植物，會影響民眾與牲畜健康，而影響更深的是生態失衡。銀膠菊在台灣若形成穩定族群後，將會排擠本地植物的生存空間。台灣到處都有許多「不該來的人」--第五縱隊，他們由情治單位去監控，我們也不容「匪諜」在我們身邊；對於我們身邊的「惡性外來入侵種」如小花蔓澤蘭、銀膠菊等，也不容它們在我們身邊，民間應該協力加以清除。
協會增公益理監事　射協：台灣若被奧會停權，可能永遠回不去了,2017-05-02 18:04,單項運動協會改革近來因戴資穎球衣事件再度引發熱議，《國民體育法》修正草案第38條建議壓曾公益理監事，不過，射擊協會理事長陳士魁今天下午在公聽會中舉科威特與印度曾被認定「政府干涉體育」而遭停權，憂心若台灣被國際奧會（IOC）處分停權，以台灣的現勢，「可能就永遠回不去了」。至於修正案開放選手與民眾成為協會會員，陳士魁也舉射擊協會具有特殊性為例，因涉及個人不得持有，否則將違反《槍炮彈藥刀械管制條例》，因此射協從來就只有團體會員，他呼籲要考量不同協會的特殊性。立法院教育及文化委員會明天將審查《國民體育法》修正案，民進黨立委黃國書、蘇巧慧，國民黨立委柯志恩，時代力量立委林昶佐今（2）日下午舉行「體育改革修法公聽會」，針對民眾參與、協會民主化、財務透明化等《國民體育法》修正案第30至38條相關條文進行討論。馬政府時期曾任行政院秘書長，目前是六位「中華奧會」副主席之一、也是射協理事長陳士魁在會中發言時做出以上表示。陳士魁發言時強調他支持改革。他說，射擊協會多年來沒有半個個人會員，我們理由很簡單，因為《槍砲彈藥管制條例》規定，「個人不得持有槍枝」，因此到現在為止射協只有團體會員。「個人會員的身分可能是我們的理監事，我們的奧亞運國手，我們的裁判等等，這我們都設定在裏面，但現在為止我們沒有，主要的理由我們對教練、裁判還是設定，設定他曾經有幾樣前科的，不得成為教練或裁判」，陳士魁說，包括違反《槍炮彈藥管制條例》，有重傷害、性侵前科的，「到我們射擊來講，是非常大的禁忌」。他說，改革聯盟曾經替某一位選手在講話，「為什麼我們不能讓他當國家教練？因為他有前科。我這邊公開講出來，他有前科的存在，我怎麼可能讓他…我跟這位選手非常非常好的朋友，可是我也不能以私害公，就讓他當國家教練」，「在徵選過程裏面我很努力想辦法幫他開條路，但是這是射擊最基本的紅線，我們必須守這條紅線」。陳士魁說，希望各協會的特殊性能照顧到，因為射擊的確是有它的特殊性。接著他說，除了前科之外，也有一些「黑白地帶」。之前就有人討論到：賄選算不算前科？可不可以加入射擊協會，這我們現在也是在內部討論的過程。「我們就非常非常謹慎。你說人員都讓他加入的話，會不會產生人頭黨員的問題？會不會產生黑道大舉加入射擊協會的問題？黑道漂白，或是黑道隱藏在裏面的，我們真的不知道，所以到現在為止，我們不敢開放任何個人會員，一直維持著團體會員的問題就在這邊」，這是射協的現況。至於「運動選手」定義，陳士魁則說，譬如說你現在是國中校隊、班隊，高中校隊，還是大學系隊，還在國家隊，運動選手的定義一定要定義清楚。「假如要加入我們協會不擔任理事的時候，政府還可指派。我剛想到一個問題：萬一它指派一個游泳選手來擔任我們射擊協會理事的時候，我們怎麼辦」？針對第33、34條有關財報部分，他則是支持黃國書的版本。「但是不是可以給我們協會一個空間」，依規定委請會計師報體育署再報中央機關公告、複核，「這一條是不是可以改為說，體育團體應於各年度結束後報主管機關送請會計師查核後公告之。換句話說，就是我們都報上去，你要找誰(會計師簽核)都可以」。陳士魁說，像他們這種小協會，「我四個職員都是25K，我們真的養不起任何…我們請一個會計師來簽，一般三萬塊到五萬，中央主管機關認可的，15到20萬，差那麼多，我們小單位…。現在體育署補助我們，但每年都要一次，15萬、20萬的經費對我們這個職員只領25K的小協會是一個額外的負擔」。至於第38條有關於公益理事、公益監事的問題，陳士魁則說，因為他常年都參與體育這塊，「所以我們也非常在意IOC（國際奧會）的處理」，「IOC的處理在最近幾年裏面，曾經有2個國家因為政府干涉體育而被停權：一個是科威特，一個是印度」，科威特是停權一次，復權又被停權，印度也是這樣。設公益理監事 陳士魁憂：台灣若被國際奧會處分可能回不去了「我們可不可以這樣做？那就面臨到一個風險。就是萬一我們被停權，我們能不能回得去？國際奧會在1996年通過一個條款，以後只有聯合國認證成員才能再加入國際奧會，換句話說，萬一我們被除權的話，以台灣目前的政治現況，我們回不去了」，陳士魁提醒。他接著說，「各位，從1961年到1981年，我們兩代的選手，可能不能參加亞運、奧運，我們犧牲兩代的選手，這中間有很多教授，曾經在左營這邊枕戈待旦，但進不去，我們進不了亞運、奧運大門」。陳士魁強調，今天我真的非常嚴肅呼籲大家，希望在國會殿堂也留在一點點紀錄，我們必須為歷史負下責任，假如我們今天政治干涉體育太多的話，我們萬一被國際奧會處分的話，可能永遠回不去了，今天台灣的現勢，我們可能永遠回不去了，這是我們的肺腑之言」。「當然還有很多條文。我們不只是要站在選手的立場，也要站在國家的立場，因為我們今天在協會這樣想，我們都不是為了協會自己，我們這個協會理事長請客還要自己掏錢，所有職員一個月拿兩萬多塊，我們這樣辛苦的耕耘，我們為得是什麼？我們不可能從這個協會拿到任何的好處，反而我們為國家、為台灣爭取更多的榮譽，真的希望大家一起來想，不是只有考慮單方面的思考」，陳士魁最後表示。
別管瓊瑤和繼子誰是誰非？你該弄懂的是鼻胃管和氣管內管的差異,2017-05-02 17:50,皇冠文化集團創辦人平鑫濤先生，罹患失智症合併急性感染，住院後因吞嚥困難插上鼻胃管進食及灌藥，這管子該不該插？插了是否符合人道？其夫人瓊瑤與繼子女爭論搬上檯面，愈演愈烈。瓊瑤認為，讓丈夫插鼻胃管受苦，深覺背叛摯愛，「加工活著就是悲劇」。繼子、皇冠出版社社長平雲則發文表示，父親儘管曾表明病危時將拒絕做任何侵入性急救，但目前「沒有醫師判定他病危或陷入重度昏迷。」插鼻胃管只是暫時的處置。鼻胃管是什麼功能？失智病患究竟該如何處置才合宜？看看不同科別醫師由目前的法律、臨床醫學及倫理上的解釋與分析：蘇文浩：末期病患需經兩名醫師確定馬偕醫院安寧療護居家照顧主任蘇文浩表示，「平先生的病況只有主治醫師清楚，我無法評論」，但就法律上來談，被認定為失智症末期的患者，依法可接受安寧醫療，放棄點滴、鼻胃管等維生醫療。不過，「如果患者不符合末期認定，即便在遺囑中表明不接受鼻胃管、插管等方式治療，但在法律上未明確界定，會存在法律與倫理的爭議，通常在患者無法清楚表達的情況下，最後還是由家屬決定。」未來《病人自主權利法》上路後，可望對病人醫療自主的部分有更明確的規範。至於所謂的「失智症末期」如何定義？蘇文浩表示，根據目前的「安寧緩和醫療條例」規定，失智症患者必須符合CDR臨床失智評分量表5分，病人沒有反應或毫無理解力，認不出人、吞食困難、大小便完全失禁、長期臥床等，且合併臨床上的緊急症狀，例如肺炎、腸阻塞等，且需經由2位主治醫師的認定，才能符合「末期」規範。台大醫學院麻醉科教授王明鉅則表示，鼻胃管不是氣管內管，擔心民眾誤會、放棄該有的治療。他認為「鼻胃管沒有那麼罪大惡極」，它是讓無法從嘴巴吃東西的患者、沒意識、或是咀嚼吞嚥困難，吞水或吞食物可能嗆到引發肺炎的患者，一種進食的「食物管」。經腸胃道消化補充營養，遠比靠打點滴更好，更有效率。王明鉅解釋，鼻胃管是一種軟管，從鼻腔穿入、進入食道、再到胃。他分析，鼻胃管放置利大於弊，壞處是不好看，臉上多了個東西很醜，一直以來有人稱鼻胃管很像大象的鼻子，且放置時不舒服，尤其意識清楚的患者感覺更強烈，會感到噁心，清醒時容易忍不住去拉扯；但是它可以供給營養，對生命的維持有很大的助益，且材質軟，戳破組織的風險低。王明鉅強調，無意批評任何人的家務事，要做什麼醫療處置當然是由家人決定。只不過，他擔心瓊瑤提及的插管事件引發效應，讓人對「插管」的字面可能產生誤導，會讓人混淆鼻胃管與氣管內管，「此管非彼管」，氣管內管是指患者無法呼吸的急救措施，鼻胃管與急救扯不上邊，前者幾分鐘內不處理患者可能會死，後者是幾小時、甚至一天不放都不會怎樣。王明鉅說，如果出現任何一位患者或家屬誤會以為鼻胃管就是急救插管，而放棄可能保命的治療，那都不值得。以平老先生兒子的說法，平先生是失智、非病危，還算健康，只是吃東西易嗆到，除非本人有強調寧可餓死也不放鼻胃管，「否則任何醫師大概都會建議都會放。」王明鉅：除非確定將往生、否則沒有不放鼻胃管的道理 王明鉅認為，部分媒體把插鼻胃管這件事炒作成「安寧療護」的觀念很不妥，讓一個並不會在幾小時、幾天內死亡的患者，餓到半死，這對病人來說也是痛苦，「個人不認為這叫安寧，一點都不安寧，挨餓很難受」。即便是植物人，但身體仍健康，也是要以鼻胃管灌食，不放，不覺得殘忍嗎？除非很明顯患者在幾小時、短短幾天內就會往生，否則沒有不放的道理。」「很多人都是靠鼻胃管救回的，共存幾十天、幾年的人不在少數。」王明鉅表示，放置鼻胃管不必擔心一定會拔不下來，視病人情況可以拔管、訓練自主進食，並不一定會長久置放，很多都只是暫時性的處置。若是「氣管內管」的插管，王明鉅說，商議的空間就比較大，氣管內管會造成患者較大的痛苦，無法言語、咳嗽不適，如果已能預見生命終點的末期病患，不插管、讓病人好好的去，這才是安寧療護的精神。簡立建：若75歲、ICU住一周以上，積極治療就不樂觀台北市聯合醫院和平婦幼院區急診醫學科主任簡立建指出，氣管內管是針對不能自主呼吸的患者，用氣管內管幫助其呼吸順暢，除急救之外，有些患者因年老或體衰無法咳痰，也可以考慮插氣管內管協助暢通呼吸，但這比較受罪，插管不能講話，且有強烈異物感而咳嗽。若緊急醫療、患者有很大機會可救治的情況下，會建議家屬同意接受氣管內管處置。簡立建指出，放鼻胃管一方面可排空胃部氣體和液體，一方面可以進行流質食物的灌食，因此像是厭食症已瘦弱到危及生命、術後引流，或身體機能未到末期但進食有困難者，都會建議放置鼻胃管。若是需要長期接受灌食的，可以評估「經皮內視鏡胃造口」的作法，也就是在肚皮上打洞、接管到胃的作法，會比較不受罪，但也有感染風險，視病人情況決定。「不論是插鼻胃管，或氣管內管，這兩者多半都是暫時的。」簡立建認為，如果非末期患者，積極接受治療是必要的，若已經末期、生命即將到終點，就應接受安寧緩和的觀念。美國曾於2000年追蹤住在加護病房一周以上的75歲以上長者，一年後存活率不到10%。顯見，許多末期的積極治療只是增加患者的痛苦，最後仍是徒勞無功。【延伸閱讀】《瓊瑤催淚的插管控訴文　平鑫濤子發聲明駁：父親沒有病危、只是失智！》《插不插管、如何維生？「安寧緩和醫療條例」三修後善終選擇早已更彈性》 
美學者：輻射影響時間長遠 媽媽盟：日食品應詳標輻射值,2017-05-02 17:39,去年年底引發爭議的日本輻射食品進口議題，行政院再次於四月底召開專案會議討論，立委黃國昌和媽媽監督核電廠聯盟今（2）日舉辦《輻射影響與食品安全》座談，邀請美國南卡羅來納大學莫梭博士( Dr. Tim Mousseau)來台，莫梭指出，科學研究發現輻射影響時間極長，像是30年前車諾比核災的輻射到現在都還讓德國的野豬和俄羅斯的鳥類產生基因變異，應該「未雨綢繆」，媽媽盟則再次呼籲，為了下一代的健康，政府應該嚴加把關。莫梭指出，根據目前的研究結果來看，其實任何輻射都會對生物的身體造成影響，低濃度低劑量輻射還是會有影響，自然界的輻射也有影響，但是在醫學的範疇中，過去對此很難深入分析，因為和動物或植物不同，人體的實驗研究不容易做，直到現在經過長時間的研究，發現電腦斷層掃描，即便只有6豪西弗的劑量，也明顯提高了民眾的癌症風險，甚至癌症風險會因此增加一倍，有些人做過數次電腦斷層掃描，癌症風險會因此而更高。莫梭表示，以台灣來說，有三座正在運作、一座停工的核電廠，密集度相對來說算是滿高的，關閉所有核電廠，或是停止興建，其實人類還是會接觸到未來更長遠的輻射影響，有很多核電廠面臨老舊的問題，有外洩或是安全的疑慮，這樣的情況下散發的輻射量有更高的疑慮，莫梭以現在美國很多老舊核電廠為例，指出這些核電廠其實都在外洩大量的輻射，甚至影響供水系統，造成民眾的疑慮和擔憂。談到剛剛滿30週年的車諾比核災，莫梭也表示，這個災難對整個歐洲都帶來很大的影響，現在在德國如果去獵一隻野豬，有三分之一的豬都不能吃，因為野豬吃的蕈菇到現在都還有高濃度的車諾比輻射，導致野豬的身上也還有過高劑量的銫輻射而無法食用，莫梭也指出，透過研究雄性鳥類的精液，發現在車諾比附近，高劑量的輻射影響區，39%鳥類都有不孕的情況，隨著濃度越來越低，不孕症情況則越來越少。莫梭強調，他並不反對核能，他進行研究是因為希望能以科學家的身份提供新的知識，他認為車諾比或福島的事件，都不會是核能議題的終結，這個世界不會沒有核能，核電廠也會繼續散發輻射，重要的是科學家需要繼續進行資料搜集、分析和研究，莫梭也強調，現在研究的資源上會受限於出資方的態度，但他還是希望科學家可以獨立研究，因為這樣做出來的結果才會接近真實。媽媽盟楊順美表示，她以做為一個媽媽的角度來看輻射食品的議題，日本在福島核災後，至今仍有八成的民眾都不信任福島的食品，也因此有許多地方社區自動自發開始做輻射檢測，也不相信政府所訂出的「對人體無害的標準」，台灣的民眾應該有權利要求所有日本進口食品都要清楚標示，而非只有一個「合格」的標籤，主管機關也應該更加重視輻射對人體健康及後代基因演變的影響。
世大運維安比照登機 柯P：可否帶國旗入場照奧會規定,2017-05-02 17:15,2017台北世大運即將上場，日前舉辦世大運田徑測試賽，警方安檢時竟檢出打火機、剪刀等164件違禁品，台北市長柯文哲今（2）日回應，賽事期間將比照登機的維安標準，至於是否可以攜帶國旗入場，柯文哲說，遵照奧會規定處理。台北市政府今天舉行「田徑人站出來、世大運拿金牌」記者會，包括紀政、戴世然、李福恩等歷任亞洲田徑賽金牌手均出席力挺，柯文哲表示，希望這次台灣的選手們回到自己的土地上比賽，在主場優勢下爭取最好成績。柯文哲說，看到現場許多亞洲田徑賽金牌選手，勾起他當年的回憶，當時他讀新竹中學時，就對有「亞洲欄架王子」封號的戴世然很有印象，今天看到這些曾為台灣奪得金牌的選手，覺得滿幸福的。這次台灣具主場優勢，預估世大運能拿到幾金？柯文哲會後聯訪時說，金牌的精確估計是由體育署負責，北市府能夠做的就是找贊助，像這次東華扶輪社就贊助拿到田徑金牌的選手100萬元獎金、銀牌50萬元，銅牌30萬元，但共有22個比賽項目，所以還要去找其他的贊助者，希望其他比賽項目的獲獎選手也有獎金。柯文哲透露，體育署之前估計，我國在世大運拿到獎牌最多的一次是第7名，所以體育署一直把奪金的數量當成機密，秘密訓練選手，但據他所知，我國的滑輪可望得到比較多的金牌。北市府舉行「田徑人站出來、世大運拿金牌」記者會，柯文哲、紀政、戴世然、李福恩等歷任亞洲田徑賽金牌選手均出席。之前跑步摔倒，有沒有打算再練練看？柯文哲苦笑道，現在已經50幾歲，不能想像自己還停留在20幾歲，摔過一次就可以了。針對日前測試賽中，被驗出有164項違禁品一事，柯文哲回應，這還是要按照世大運和國際的維安標準，會使用X光機、金屬探測器等，到時候真正比賽，會跟機場的檢查差不多，所以像打火機、瓶裝水等都會被攔，屆時民眾去參觀比賽，還是要注意，就把它當作是要去登機的維安標準。是否開放帶國旗？柯文哲強調，他擔任主辦城市的負責人，之前也有簽保證書，會遵守奧會的相關規定，媒體詢問，這樣是否會造成中國反彈？柯文哲說「你不要問，人家就不會反彈」。
