news ID,url,title,time,content
udn201707092217002,https://udn.com//news/story/6811/2573492?from=udn-ch1_breaknews-1-99-news,新加坡結霜橋跳蚤市場 將吹熄燈號,2017/07/09 22:17,新加坡結霜橋跳蚤市場將吹熄燈號，走過80多個年頭的舊貨市場曾見證經濟起飛的年代，攤位上的古董鐘錶、錢幣等舊式生活用品，更讓這裡彷彿進入如幻似真的時光長廊。結霜橋跳蚤市場位於雙溪路，狹窄的道路兩旁堆放諸如舊書、鐘錶、唱盤、CD、手機、相機、五金用具、衣服、褲子等各式各樣二手貨品。這裡的價格雖然優惠實在，殺價聲仍此起彼落，淘寶者抱持撿便宜心態，賣家也使出看家本領，全力出清手中存貨。走進結霜橋跳蚤市場，不難發現這裡猶如早年新加坡社會發展縮影。星國媒體報導，這裡在1930年代已是頗具規模買賣舊貨市場，不過也曾經是銷贓的好去處，又被稱為「賊市場」。新加坡聯合早報報導，結霜橋跳蚤市場在1970年代初期，還販賣軍用水壺、便當盒、巴冷刀等軍事用品，讓少數迷糊遺失軍品的阿兵哥「補貨」，免受軍法處置。不過，物換星移，結霜橋跳蚤市場販售的貨品也更加多元，特別是受到諸多印度、孟加拉、印尼及馬來西亞等地來的外籍勞工青睞，也販售生活中最實用的各種小家電、衣服或褲子等物品。9日是吹熄燈號前最後一個星期日，除了原本定期造訪撿便宜的外籍勞工外，大批懷舊的新加坡人、文史工作者更舊地重遊，希望回憶兒時到跳蚤市場淘寶的興奮之情。不少老一輩新加坡人彎下腰、神情專注的挑選攤位上的流行音樂專輯，不乏有台灣知名藝人費玉清或豬哥亮等秀場DVD。新加坡舊貨業者說，跳蚤市場吹熄燈號令人不捨，不過，他相信自己攤位販賣的時鐘所顯示的「時間」，將會永遠記住這段記憶長河。結霜橋跳蚤市場10日將吹熄燈號，新的舊貨市場將搬遷他處。新加坡結霜橋跳蚤市場將吹熄燈號，走過80多個年頭的舊貨市場曾見證經濟起飛的年代，攤位上的古董鐘錶、錢幣等舊式生活用品，更讓這裡彷彿進入如幻似真的時光長廊。結霜橋跳蚤市場位於雙溪路，狹窄的道路兩旁堆放諸如舊書、鐘錶、唱盤、CD、手機、相機、五金用具、衣服、褲子等各式各樣二手貨品。這裡的價格雖然優惠實在，殺價聲仍此起彼落，淘寶者抱持撿便宜心態，賣家也使出看家本領，全力出清手中存貨。走進結霜橋跳蚤市場，不難發現這裡猶如早年新加坡社會發展縮影。星國媒體報導，這裡在1930年代已是頗具規模買賣舊貨市場，不過也曾經是銷贓的好去處，又被稱為「賊市場」。新加坡聯合早報報導，結霜橋跳蚤市場在1970年代初期，還販賣軍用水壺、便當盒、巴冷刀等軍事用品，讓少數迷糊遺失軍品的阿兵哥「補貨」，免受軍法處置。不過，物換星移，結霜橋跳蚤市場販售的貨品也更加多元，特別是受到諸多印度、孟加拉、印尼及馬來西亞等地來的外籍勞工青睞，也販售生活中最實用的各種小家電、衣服或褲子等物品。9日是吹熄燈號前最後一個星期日，除了原本定期造訪撿便宜的外籍勞工外，大批懷舊的新加坡人、文史工作者更舊地重遊，希望回憶兒時到跳蚤市場淘寶的興奮之情。不少老一輩新加坡人彎下腰、神情專注的挑選攤位上的流行音樂專輯，不乏有台灣知名藝人費玉清或豬哥亮等秀場DVD。新加坡舊貨業者說，跳蚤市場吹熄燈號令人不捨，不過，他相信自己攤位販賣的時鐘所顯示的「時間」，將會永遠記住這段記憶長河。結霜橋跳蚤市場10日將吹熄燈號，新的舊貨市場將搬遷他處。
udn201707092216000,https://udn.com//news/story/6809/2573490?from=udn-ch1_breaknews-1-99-news,摩蘇爾IS困獸之鬥 派出媽媽自殺炸彈客,2017/07/09 22:16,伊拉克今天宣告擊敗伊斯蘭國（IS）收復摩蘇爾，城內好戰分子在最後頑抗時派出許多女性炸彈客。照片顯示，1名婦女抱著寶寶似乎要逃難，但進一步檢視發現她攜有炸彈發動攻擊。英國 「每日郵報」網站（MailOnline）報導，這名媽媽自殺炸彈客引爆炸彈前沒多久，被拍到她走過伊拉克部隊跟前，手上抱著她的寶寶。她與一群逃難的平民，從伊拉克部隊剛解放的摩蘇爾（Mosul）市區走出來，手上握有引爆器、袋子，臂彎裡抱著1名幼兒。當地Mawsleya電視台1名攝影師說，這名婦女行經伊拉克軍人時似試圖引爆爆裂物，但當時炸彈沒成功引爆，直到她走稍遠一點才爆炸。爆炸造成她本人和小孩以及2名軍人喪命，還有多名平民受傷。伊拉克當局今天宣布擊潰伊斯蘭國，收復摩蘇爾。伊斯蘭國最後幾天的領土遭削減到僅剩600平方公尺。最後只剩200名伊斯蘭國戰士負隅頑抗，持續抵抗伊軍，還選出女性擔任自殺炸彈客，想作最後一搏。過去2週，據信有20多名女性自殺炸彈客混在平民間，成功引爆炸彈。伊拉克今天宣告擊敗伊斯蘭國（IS）收復摩蘇爾，城內好戰分子在最後頑抗時派出許多女性炸彈客。照片顯示，1名婦女抱著寶寶似乎要逃難，但進一步檢視發現她攜有炸彈發動攻擊。英國 「每日郵報」網站（MailOnline）報導，這名媽媽自殺炸彈客引爆炸彈前沒多久，被拍到她走過伊拉克部隊跟前，手上抱著她的寶寶。她與一群逃難的平民，從伊拉克部隊剛解放的摩蘇爾（Mosul）市區走出來，手上握有引爆器、袋子，臂彎裡抱著1名幼兒。當地Mawsleya電視台1名攝影師說，這名婦女行經伊拉克軍人時似試圖引爆爆裂物，但當時炸彈沒成功引爆，直到她走稍遠一點才爆炸。爆炸造成她本人和小孩以及2名軍人喪命，還有多名平民受傷。伊拉克當局今天宣布擊潰伊斯蘭國，收復摩蘇爾。伊斯蘭國最後幾天的領土遭削減到僅剩600平方公尺。最後只剩200名伊斯蘭國戰士負隅頑抗，持續抵抗伊軍，還選出女性擔任自殺炸彈客，想作最後一搏。過去2週，據信有20多名女性自殺炸彈客混在平民間，成功引爆炸彈。
udn201707092216001,https://udn.com//news/story/6809/2573471?from=udn-ch1_breaknews-1-99-news,人美心更美 台灣女孩烏干達扶貧行善,2017/07/09 22:16,台灣女孩尤絲庫遠赴東非烏干達扶貧行善，成立「天愛婦女自助計畫」，幫助婦女自立更生與孩童就學，她期待透過微小力量吸引更多善心人士，帶給弱勢族群希望和機會。尤絲庫（Yoshiku）是台灣原住民，2014年參加東非自助旅行路經烏干達，被當地民眾的友善深深吸引，回台後念念不忘。隔年再度到烏干達，在距離首都康培拉（Kampala）約30分鐘車程的村落奇那瓦（Kinaawa），與志同道合的3名年輕人共創「天愛婦女自助計畫」。當記者問到基於何種原因，可以讓年僅27歲且外貌出眾的她，在物資條件艱困的環境，堅持志工理念直到現在？她說：「我也曾經迷失在台灣繁華社會裡，追求物質享受。只不過幾年前偶然發現烏干達村落裡的村民，不因生活困頓改變人性本善的樣貌，深受感動，願意為他們做些甚麼。」「我其實並不特別，只是選了一條行人比較少的道路而已。」在烏干達扶貧初期捉襟見肘的日子很辛苦，只能幫助村中婦女採購簡單材料製成手工飾品，託付台灣親友轉賣換取微薄小利。漸漸地，累積小收益，加上善心人士小額捐贈，這群年輕人購買5台手動式縫紉機，讓6名原本無業的婦女縫製服飾到城裡販賣，自食其力，賺取微薄薪資。尤絲庫說：「我們堅持這些媽媽必須從薪資中提撥20%做儲蓄。如此不但改善她們的日常生活，也養成儲蓄的好習慣。」尤絲庫在台灣原是英文教師，可是面對英文並不普遍的小村落，她認真學習當地語言魯甘達（Luganda），透過語言傳遞真心實意，讓村民更能接受她。對於未來規畫，尤絲庫說：「以孩童教育為優先，其次是輔導單親媽媽（高達67%）能有一技之長，最後是與當地社工團體合作，檢測愛滋、宣導節育、家庭燒燙傷防治以及施打疫苗等。」尤絲庫至少每年回台一次，藉由分享烏干達真實故事，期待接引更多善心人士。雖然募得資金有限，但招募到多名台灣年輕志工前往烏干達，共襄盛舉，讓她十分感動與感謝。她與夥伴們長期照顧40名孩童，幫助他們就學，也常走村串戶做家訪，瞭解個案家中情況，予以適當的輔導和鼓勵，協助他們增長見聞和衛教知識，甚至分享聖經裡的故事等，不一而足。記者問及與村民結緣是否與自身是原住民有關時，尤絲庫笑笑，說：「大概有吧！我的家境並不富裕，很能體會貧困人建立自信心的重要。事實上，烏干達貧窮村民所期待的是更多的希望和機會，而不僅是金錢或物資的給予。」她說，如果志工團隊成熟，將拓展到另外村落，幫助更多需要幫助的人。「尤絲庫」的意思是「好女孩」，她在探索人生意義的同時，散發出的愛，溫暖一群毫無血緣關係的人。一路顛簸走來，尤絲庫面臨過許多挫折與無奈，包括烏干達男尊女卑的傳統觀念，許多男人落跑，由女性承擔養家活口重任，或因故不能向當地政府申請補助，以及落後地區教育並不普及等。她說，不過當看到當地婦女和孩子燦爛笑容時候，一切辛苦都值得。台灣女孩尤絲庫遠赴東非烏干達扶貧行善，成立「天愛婦女自助計畫」，幫助婦女自立更生與孩童就學，她期待透過微小力量吸引更多善心人士，帶給弱勢族群希望和機會。尤絲庫（Yoshiku）是台灣原住民，2014年參加東非自助旅行路經烏干達，被當地民眾的友善深深吸引，回台後念念不忘。隔年再度到烏干達，在距離首都康培拉（Kampala）約30分鐘車程的村落奇那瓦（Kinaawa），與志同道合的3名年輕人共創「天愛婦女自助計畫」。當記者問到基於何種原因，可以讓年僅27歲且外貌出眾的她，在物資條件艱困的環境，堅持志工理念直到現在？她說：「我也曾經迷失在台灣繁華社會裡，追求物質享受。只不過幾年前偶然發現烏干達村落裡的村民，不因生活困頓改變人性本善的樣貌，深受感動，願意為他們做些甚麼。」「我其實並不特別，只是選了一條行人比較少的道路而已。」在烏干達扶貧初期捉襟見肘的日子很辛苦，只能幫助村中婦女採購簡單材料製成手工飾品，託付台灣親友轉賣換取微薄小利。漸漸地，累積小收益，加上善心人士小額捐贈，這群年輕人購買5台手動式縫紉機，讓6名原本無業的婦女縫製服飾到城裡販賣，自食其力，賺取微薄薪資。尤絲庫說：「我們堅持這些媽媽必須從薪資中提撥20%做儲蓄。如此不但改善她們的日常生活，也養成儲蓄的好習慣。」尤絲庫在台灣原是英文教師，可是面對英文並不普遍的小村落，她認真學習當地語言魯甘達（Luganda），透過語言傳遞真心實意，讓村民更能接受她。對於未來規畫，尤絲庫說：「以孩童教育為優先，其次是輔導單親媽媽（高達67%）能有一技之長，最後是與當地社工團體合作，檢測愛滋、宣導節育、家庭燒燙傷防治以及施打疫苗等。」尤絲庫至少每年回台一次，藉由分享烏干達真實故事，期待接引更多善心人士。雖然募得資金有限，但招募到多名台灣年輕志工前往烏干達，共襄盛舉，讓她十分感動與感謝。她與夥伴們長期照顧40名孩童，幫助他們就學，也常走村串戶做家訪，瞭解個案家中情況，予以適當的輔導和鼓勵，協助他們增長見聞和衛教知識，甚至分享聖經裡的故事等，不一而足。記者問及與村民結緣是否與自身是原住民有關時，尤絲庫笑笑，說：「大概有吧！我的家境並不富裕，很能體會貧困人建立自信心的重要。事實上，烏干達貧窮村民所期待的是更多的希望和機會，而不僅是金錢或物資的給予。」她說，如果志工團隊成熟，將拓展到另外村落，幫助更多需要幫助的人。「尤絲庫」的意思是「好女孩」，她在探索人生意義的同時，散發出的愛，溫暖一群毫無血緣關係的人。一路顛簸走來，尤絲庫面臨過許多挫折與無奈，包括烏干達男尊女卑的傳統觀念，許多男人落跑，由女性承擔養家活口重任，或因故不能向當地政府申請補助，以及落後地區教育並不普及等。她說，不過當看到當地婦女和孩子燦爛笑容時候，一切辛苦都值得。
udn201707092211000,https://udn.com//news/story/7321/2573525?from=udn-ch1_breaknews-1-99-news,哥哥亂講亡弟生前搞外遇 法官認定誹謗死人判刑,2017/07/09 22:11,基隆市李姓男子原在弟弟公司任職，前年6月弟弟因故死亡，他另起爐灶爭奪客源，竟向親友聲稱胞弟生前和員工的媽媽有染；李的弟媳不甘受辱，訴請偵辦，法官認為李造成其亡弟名譽受損，事後無悔意，依誹謗死者罪判他拘役40天。檢方調查，李男（63歲）原本在弟弟、弟媳合開的公司上班，前年6月弟弟逝世，他在外開了間一模一樣的公司，為了商業利益招攬原公司客戶，向鄰居散布胞弟生前搞外遇，甚至在弟弟過世當天和親友說「另名員工的媽媽和弟弟有不尋常關係」。同年11月間，李的弟媳輾轉經親友告知，死去的先生竟被哥哥在外亂放話，說他生前和員弟的媽媽林女有染，暗地裡搞外遇，她不甘亡夫受辱，向地檢署訴請偵辦。李到案坦承犯行，供稱有向親戚、朋友傳述弟弟和林女有染等語，他的表弟也證稱，曾聽到李說胞弟和林女有不尋常關係等語，而林女則喊冤說，根本不認識李男的哥哥，雙方沒有不正常男女關係。檢方偵結查無外遇一事，依李的自白、證人供詞依法起訴；法官認為，李在其弟死亡後誹謗他，造成死者名譽受損，法治觀念偏差，事後也未和弟媳達成和解，依誹謗死者罪判他拘役40日，得易科罰金4萬元。律師林富貴指出，中國人特別重視家族名聲，對於往生者的名譽仍然受到保護，所以用足以貶損他人人格之言詞，使其本人或後世子孫名譽受損，妨害名譽都成立。他指出，最有名判例為40年前潮州文獻發行人郭壽華，在文中指韓死於柳州是因罹患花柳病，韓的後代孫韓思道一狀告進法院，一、二審都判郭敗訴；另去年底高雄某牧師在告別式上，指躺在棺木的教友有外遇、婚外情，經家屬控告法院判4個月，得易科罰金12萬元。基隆市李姓男子原在弟弟公司任職，前年6月弟弟因故死亡，他另起爐灶爭奪客源，竟向親友聲稱胞弟生前和員工的媽媽有染；李的弟媳不甘受辱，訴請偵辦，法官認為李造成其亡弟名譽受損，事後無悔意，依誹謗死者罪判他拘役40天。檢方調查，李男（63歲）原本在弟弟、弟媳合開的公司上班，前年6月弟弟逝世，他在外開了間一模一樣的公司，為了商業利益招攬原公司客戶，向鄰居散布胞弟生前搞外遇，甚至在弟弟過世當天和親友說「另名員工的媽媽和弟弟有不尋常關係」。同年11月間，李的弟媳輾轉經親友告知，死去的先生竟被哥哥在外亂放話，說他生前和員弟的媽媽林女有染，暗地裡搞外遇，她不甘亡夫受辱，向地檢署訴請偵辦。李到案坦承犯行，供稱有向親戚、朋友傳述弟弟和林女有染等語，他的表弟也證稱，曾聽到李說胞弟和林女有不尋常關係等語，而林女則喊冤說，根本不認識李男的哥哥，雙方沒有不正常男女關係。檢方偵結查無外遇一事，依李的自白、證人供詞依法起訴；法官認為，李在其弟死亡後誹謗他，造成死者名譽受損，法治觀念偏差，事後也未和弟媳達成和解，依誹謗死者罪判他拘役40日，得易科罰金4萬元。律師林富貴指出，中國人特別重視家族名聲，對於往生者的名譽仍然受到保護，所以用足以貶損他人人格之言詞，使其本人或後世子孫名譽受損，妨害名譽都成立。他指出，最有名判例為40年前潮州文獻發行人郭壽華，在文中指韓死於柳州是因罹患花柳病，韓的後代孫韓思道一狀告進法院，一、二審都判郭敗訴；另去年底高雄某牧師在告別式上，指躺在棺木的教友有外遇、婚外情，經家屬控告法院判4個月，得易科罰金12萬元。
udn201707092205000,https://udn.com//news/story/6812/2573505?from=udn-ch1_breaknews-1-99-news,爆買還不夠 大陸土豪瘋上百萬日本豪華醫療,2017/07/09 22:05,"大陸遊客在日本瘋狂購物的行為，被日本媒體戲稱為「爆買」，陸客的大手筆更是讓許多商家趨之若鶩。而如今除了購物之外，前往日本高價求醫的陸客越來越多，令日本各大醫院出現了前所未有的「醫療爆買」現象，分析認為，這也為日本的其他服務業帶來了無窮商機。新加坡聯合早報引述日本著名時政雜誌《Sapio》表示，日本醫療服務受到陸客好評，越來越多陸客不惜重金到日本求醫。日本政府也把握機會開放醫療服務，對陸客發出「醫療簽證」，也進一步促進了這方面的需求。這種發給陸客的日本「醫療簽證」，不止能讓需要治療的人入境，他們的家屬也可陪同多次往返。該報導稱，這些大陸富裕階層有些是一人到日本住院，10來名親屬「陪醫」，有時出手之闊綽的現象也令人咋舌。例如大陸吉林省一位富商的60多歲父親，因為患了末期喉癌，大陸醫生說他只剩下一個月壽命。但這名富商不放棄，帶了父親到日本動手術。為陪父親治療。這位富商取得了可多次往返的日本醫療簽證。而他父親的手術成功，住院一個月包括治療費，總共花了2,000萬日圓（約新台幣600萬元）。但這個大陸商人以竟然以現金付帳，讓醫院人員瞠目結舌。日本經濟新聞近期發表的資料顯示，如今獲取簽證到日本求醫的外國人比2011年多了13倍，其中陸客占了90%。一家專為到日本求醫的外國人提供諮詢服務的公司透露，這類諮詢要求每年平均有1萬多件，每個個案涉及的治療費大多都在600萬日圓（約新台幣162萬元）以上。顯然，大陸的「求醫團」已成為日本醫療界的一塊肥肉。《Sapio》雜誌指出，大陸富人到日本接受一次體檢的費用至少需要100萬日圓（約新台幣27萬元），這相當於一般日本人的三倍。一些高級配套的內容還包括打高爾夫球、入住五星級飯店等。居中牽線的仲介公司還附帶日語翻譯，這都大大提高了旅遊的價格。報導稱，當局推動醫療與旅遊掛鉤讓日本醫師協會很不以為然，認為醫療不應當沾染過重的商業色彩。然而，陸客願意付出高價來求醫，是日本各地的醫療機構難以抗拒的機會。位於日本千葉鴨川市的龜田綜合醫院，去年就接待了200個陸客體檢觀光團。這家醫院特為遠道而來的客人修建了豪華的候客廳，廳裡擺放著高島屋百貨公司的禮品冊子。一些陸客體檢完之後，就會乘計程車去百貨公司購物。有些海外豪客還是乘私人飛機直達醫院的。該醫院的理事長龜田隆明認為，日本人口持續減少，地方醫院要生存和發展不容易。陸客給了他們新的商機，不用單靠政府津貼，這對醫院的財政有很大幫助。日本多摩大學研究醫療經濟學的教授真野俊樹說，「日本是中國的鄰國，近水樓臺，中國的富裕階層不在乎花錢，求的是一個安心的治療，以及可信任的體檢環境」。大陸遊客在日本瘋狂購物的行為，被日本媒體戲稱為「爆買」，陸客的大手筆更是讓許多商家趨之若鶩。而如今除了購物之外，前往日本高價求醫的陸客越來越多，令日本各大醫院出現了前所未有的「醫療爆買」現象，分析認為，這也為日本的其他服務業帶來了無窮商機。新加坡聯合早報引述日本著名時政雜誌《Sapio》表示，日本醫療服務受到陸客好評，越來越多陸客不惜重金到日本求醫。日本政府也把握機會開放醫療服務，對陸客發出「醫療簽證」，也進一步促進了這方面的需求。這種發給陸客的日本「醫療簽證」，不止能讓需要治療的人入境，他們的家屬也可陪同多次往返。該報導稱，這些大陸富裕階層有些是一人到日本住院，10來名親屬「陪醫」，有時出手之闊綽的現象也令人咋舌。例如大陸吉林省一位富商的60多歲父親，因為患了末期喉癌，大陸醫生說他只剩下一個月壽命。但這名富商不放棄，帶了父親到日本動手術。為陪父親治療。這位富商取得了可多次往返的日本醫療簽證。而他父親的手術成功，住院一個月包括治療費，總共花了2,000萬日圓（約新台幣600萬元）。但這個大陸商人以竟然以現金付帳，讓醫院人員瞠目結舌。日本經濟新聞近期發表的資料顯示，如今獲取簽證到日本求醫的外國人比2011年多了13倍，其中陸客占了90%。一家專為到日本求醫的外國人提供諮詢服務的公司透露，這類諮詢要求每年平均有1萬多件，每個個案涉及的治療費大多都在600萬日圓（約新台幣162萬元）以上。顯然，大陸的「求醫團」已成為日本醫療界的一塊肥肉。《Sapio》雜誌指出，大陸富人到日本接受一次體檢的費用至少需要100萬日圓（約新台幣27萬元），這相當於一般日本人的三倍。一些高級配套的內容還包括打高爾夫球、入住五星級飯店等。居中牽線的仲介公司還附帶日語翻譯，這都大大提高了旅遊的價格。報導稱，當局推動醫療與旅遊掛鉤讓日本醫師協會很不以為然，認為醫療不應當沾染過重的商業色彩。然而，陸客願意付出高價來求醫，是日本各地的醫療機構難以抗拒的機會。位於日本千葉鴨川市的龜田綜合醫院，去年就接待了200個陸客體檢觀光團。這家醫院特為遠道而來的客人修建了豪華的候客廳，廳裡擺放著高島屋百貨公司的禮品冊子。一些陸客體檢完之後，就會乘計程車去百貨公司購物。有些海外豪客還是乘私人飛機直達醫院的。該醫院的理事長龜田隆明認為，日本人口持續減少，地方醫院要生存和發展不容易。陸客給了他們新的商機，不用單靠政府津貼，這對醫院的財政有很大幫助。日本多摩大學研究醫療經濟學的教授真野俊樹說，「日本是中國的鄰國，近水樓臺，中國的富裕階層不在乎花錢，求的是一個安心的治療，以及可信任的體檢環境」。"
