news ID,url,title,time,content
udn201707092227000,https://udn.com//news/story/7266/2573549?from=udn-ch1_breaknews-1-99-news,音樂神童江璟亮 13歲錄取紐約大學,2017/07/09 22:27,台灣第一位獲英國Mensa天才協會頒發天才兒童證書的江璟亮，以13歲之姿，獲美國紐約大學（NYU）、加州大學聖塔克魯茲分校等2所世界前百大名校錄取，更是NYU第一位以13歲低齡錄取的大學本科生，創下台灣土生土長、7年級就被美國頂尖大學錄取的首例，堪稱台灣之光。江璟亮說，他接到紐約大學錄取通知時相當興奮，真的滿懷感謝，真的能走到這一天，非常感謝紐約大學願意破格錄取。江稜裕身為單親媽媽，從一手拉拔江璟亮長大，她回憶說，江璟亮4歲前，母子只能透過翻譯機溝通，讓她一度懷疑兒子「有問題」，去看了醫生才知道兒子是「天才」，IQ超過160。江璟亮暑假過後是北市民生國中8年級學生，去年底才剛滿13歲，但他的天份已在各領域展現，作為興趣的彈鋼琴、拉小提琴，早已一路在國內各項鋼琴、小提琴比賽一路稱霸，10歲更在有18年歷史的日本濱松PIARA國際鋼琴大賽拿下少年組總冠軍。此外，江璟亮也拿過北市兒童美術創作金牌、全國體能錦標賽銀牌，小三就獲得英國Mensa天才協會頒發天才兒童證書，語言天分也相當厲害，9歲即拿到劍橋英檢大學程度，成為亞洲第一人，11歲以627分特優成績通過托福PBT測驗，相當全民英檢最高級，也是年紀最輕保持人。江璟亮透過自學，準備美國大學入學考試，去年10月以高分通過美國大學入學高考測驗（SAT），成績進全美前1%，目前已經通過生物、環境科學、微積分、音樂理論等4科「大學學分先修課程」（AP）。因為未來想研究罕見疾病融合音樂興趣，江璟亮選擇就讀設有醫學院、音樂學院的NYU。但這些榮耀的背後，媽媽也說，一路走來十分辛苦，自己的英文不好，「璟亮必須靠自己才能完成他的夢想」。目前江璟亮已獲得NYU同意可延後一年明年再就讀，盼利用這一年籌措兒子學費，為進入大學做好準備，包括完成6科的AP，明年上大學後可以專心唸書。據了解，江璟亮雖學籍在民生國中，但因為是是在家自學，超齡學習，所以極少到校，教務主任黃雅莉說，每當璟亮來學校時，也都會跟同學打招呼，看起來非常穩重。台灣第一位獲英國Mensa天才協會頒發天才兒童證書的江璟亮，以13歲之姿，獲美國紐約大學（NYU）、加州大學聖塔克魯茲分校等2所世界前百大名校錄取，更是NYU第一位以13歲低齡錄取的大學本科生，創下台灣土生土長、7年級就被美國頂尖大學錄取的首例，堪稱台灣之光。江璟亮說，他接到紐約大學錄取通知時相當興奮，真的滿懷感謝，真的能走到這一天，非常感謝紐約大學願意破格錄取。江稜裕身為單親媽媽，從一手拉拔江璟亮長大，她回憶說，江璟亮4歲前，母子只能透過翻譯機溝通，讓她一度懷疑兒子「有問題」，去看了醫生才知道兒子是「天才」，IQ超過160。江璟亮暑假過後是北市民生國中8年級學生，去年底才剛滿13歲，但他的天份已在各領域展現，作為興趣的彈鋼琴、拉小提琴，早已一路在國內各項鋼琴、小提琴比賽一路稱霸，10歲更在有18年歷史的日本濱松PIARA國際鋼琴大賽拿下少年組總冠軍。此外，江璟亮也拿過北市兒童美術創作金牌、全國體能錦標賽銀牌，小三就獲得英國Mensa天才協會頒發天才兒童證書，語言天分也相當厲害，9歲即拿到劍橋英檢大學程度，成為亞洲第一人，11歲以627分特優成績通過托福PBT測驗，相當全民英檢最高級，也是年紀最輕保持人。江璟亮透過自學，準備美國大學入學考試，去年10月以高分通過美國大學入學高考測驗（SAT），成績進全美前1%，目前已經通過生物、環境科學、微積分、音樂理論等4科「大學學分先修課程」（AP）。因為未來想研究罕見疾病融合音樂興趣，江璟亮選擇就讀設有醫學院、音樂學院的NYU。但這些榮耀的背後，媽媽也說，一路走來十分辛苦，自己的英文不好，「璟亮必須靠自己才能完成他的夢想」。目前江璟亮已獲得NYU同意可延後一年明年再就讀，盼利用這一年籌措兒子學費，為進入大學做好準備，包括完成6科的AP，明年上大學後可以專心唸書。據了解，江璟亮雖學籍在民生國中，但因為是是在家自學，超齡學習，所以極少到校，教務主任黃雅莉說，每當璟亮來學校時，也都會跟同學打招呼，看起來非常穩重。
udn201707092227001,https://udn.com//news/story/6811/2573504?from=udn-ch1_breaknews-1-99-news,矽谷男人世界 性別歧視呼聲日益受重視,2017/07/09 22:27,譴責性別歧視文化的呼聲在男性主導的矽谷日益獲得迴響，包括Uber等好幾名網路業界主管還因此黯然下台。有關科技業欠缺女性，以及若干女性在科技業遭遇不公平或粗魯對待的控訴，多年來醞釀爆發，偶要達到沸點。現在有越來越多女性公開抱怨性別歧視，有些案例甚至導致男性主管下台。Uber執行長卡拉尼克（Travis Kalanick）在投資人主張清理公司遭控令人不快的企業文化壓力下，於上月辭職。同樣在6月，風險資本家卡達貝克（JustinCaldbeck）因遭控對有意融資的女性企業家有性冒犯，選擇退出矽谷Binary Capital。卡達貝克發聲明說：「對我的行為說道歉，實在不足以達意。」他說：「風險投資行業存在的權力動態，可鄙地不平等。」他提及男性風險資本家和女性企業家間，權勢差距之大「令人害怕」，並稱此環境有「性別敵意」。2013年自加拿大到矽谷的柯爾曼（KathelineColeman）告訴法新社，對矽谷環境由男人主導的程度很感震驚。她說：「所有女性創業人的新證詞顯然指向，商業會議和下班後歡樂時光的界線模糊。」她指的是結束工作後的社交聚會通常涉及喝酒。「這些可怕的歡樂時光成為惡棍風險投資人和獵豔者挑人的場所。」法國女企業主費奧雷（Eliane Fiolet）推論，就算不告上法庭，公開此類擔憂會有效，因為可以引發抵制，而在網路產業，公眾形象對留住用戶非常重要。譴責性別歧視文化的呼聲在男性主導的矽谷日益獲得迴響，包括Uber等好幾名網路業界主管還因此黯然下台。有關科技業欠缺女性，以及若干女性在科技業遭遇不公平或粗魯對待的控訴，多年來醞釀爆發，偶要達到沸點。現在有越來越多女性公開抱怨性別歧視，有些案例甚至導致男性主管下台。Uber執行長卡拉尼克（Travis Kalanick）在投資人主張清理公司遭控令人不快的企業文化壓力下，於上月辭職。同樣在6月，風險資本家卡達貝克（JustinCaldbeck）因遭控對有意融資的女性企業家有性冒犯，選擇退出矽谷Binary Capital。卡達貝克發聲明說：「對我的行為說道歉，實在不足以達意。」他說：「風險投資行業存在的權力動態，可鄙地不平等。」他提及男性風險資本家和女性企業家間，權勢差距之大「令人害怕」，並稱此環境有「性別敵意」。2013年自加拿大到矽谷的柯爾曼（KathelineColeman）告訴法新社，對矽谷環境由男人主導的程度很感震驚。她說：「所有女性創業人的新證詞顯然指向，商業會議和下班後歡樂時光的界線模糊。」她指的是結束工作後的社交聚會通常涉及喝酒。「這些可怕的歡樂時光成為惡棍風險投資人和獵豔者挑人的場所。」法國女企業主費奧雷（Eliane Fiolet）推論，就算不告上法庭，公開此類擔憂會有效，因為可以引發抵制，而在網路產業，公眾形象對留住用戶非常重要。
udn201707092220000,https://udn.com//news/story/6813/2573528?from=udn-ch1_breaknews-1-99-news,川普：是與俄合作時候 與普亭討論網安,2017/07/09 22:20,美國總統川普今天表示，目前是與俄羅斯「建設性」合作的時候了，他並表示，俄羅斯總統普亭「強烈否認」干預美國去年總統大選。川普從歐洲返國後說：「我兩度就俄羅斯干預我國選舉一事向總統普亭強力施壓。他強烈否認此事，我已表達我的意見…。」川普在這次歐洲行首度以總統身分會見蒲亭。川普在推特寫道，他和普亭討論他所稱的「不可穿透的網路安全單位」構想，以防止未來選舉遇駭。他表示，他們也討論了落實今天展開的敘利亞停火協議。「目前是與俄羅斯建設性合作，往前推進的時候了。」川普7日在德國漢堡（Hamburg）召開的20國集團（G20）高峰會場邊會晤蒲亭。俄羅斯被控試圖影響美國去年總統大選，而使這項會談蒙上陰影。幕僚說川普7日私下會晤蒲亭時，曾譴責俄國干預美國選舉，但是他拒絕公開譴責此事。蒲亭8日說他在會談中否認俄羅斯干預美國選舉，而川普也接受了他的說法。美國駐聯合國大使海利（Nikki Haley）8日表示，俄羅斯的否認早在預料之中，但是這沒有用。她告訴美國有線電視新聞網（CNN），「這是俄羅斯試圖保住面子」、「而他們無法，他們無法」。「大家都知道俄羅斯干預我們的選舉。」美國總統川普今天表示，目前是與俄羅斯「建設性」合作的時候了，他並表示，俄羅斯總統普亭「強烈否認」干預美國去年總統大選。川普從歐洲返國後說：「我兩度就俄羅斯干預我國選舉一事向總統普亭強力施壓。他強烈否認此事，我已表達我的意見…。」川普在這次歐洲行首度以總統身分會見蒲亭。川普在推特寫道，他和普亭討論他所稱的「不可穿透的網路安全單位」構想，以防止未來選舉遇駭。他表示，他們也討論了落實今天展開的敘利亞停火協議。「目前是與俄羅斯建設性合作，往前推進的時候了。」川普7日在德國漢堡（Hamburg）召開的20國集團（G20）高峰會場邊會晤蒲亭。俄羅斯被控試圖影響美國去年總統大選，而使這項會談蒙上陰影。幕僚說川普7日私下會晤蒲亭時，曾譴責俄國干預美國選舉，但是他拒絕公開譴責此事。蒲亭8日說他在會談中否認俄羅斯干預美國選舉，而川普也接受了他的說法。美國駐聯合國大使海利（Nikki Haley）8日表示，俄羅斯的否認早在預料之中，但是這沒有用。她告訴美國有線電視新聞網（CNN），「這是俄羅斯試圖保住面子」、「而他們無法，他們無法」。「大家都知道俄羅斯干預我們的選舉。」
udn201707092217000,https://udn.com//news/story/7332/2573529?from=udn-ch1_breaknews-1-99-news,第八屆海峽兩岸少兒美術大展 北京揭幕,2017/07/09 22:17,第八屆海峽兩岸少兒美術大展「未來會怎樣？」北京展今天在「今日美術館」登場，海峽兩岸暨港澳300多位孩童透過藝術創作共同暢想未來，展示了天馬行空的靈感和想像力，為觀眾開啟了一次奇妙的時空穿越之旅。展期持續至7月18日。五月分別在台灣的台北市和台南市展出的「第八屆海峽兩岸少兒美術大展——未來會怎樣？」今天移師北京，作為大陸首展，北京展開幕式吸引了眾多觀眾、媒體前來觀展、報導。以「未來會怎樣？」為主題，從兩萬多名海峽兩岸暨港澳兒童畫作中，挑選200多幅獲獎作品展出。孩子們通過繪畫作品表達了對生態、環保問題的關注，展示對未來世界的想像。策展人周櫻表示，「童畫天地」展覽有4環節，包括「小人憂天」、「共生或毀滅」、「未來會更妙」與「未來我作主」，畫作內容有科技期待、未來理想實現、憂慮環境惡化與戰爭恐懼。她指出，「小人憂天」表達孩子們對未來地球爆炸、宇宙毀滅的擔憂；「共生或毀滅」是孩子們對生態、環保問題的關注，警醒眾人關於未來該如何選擇；「未來會更妙」展示孩子們對未來世界的科學幻想；「未來我做主」展示孩子們對未來奇幻生活天馬行空的靈感和想像。周櫻說，從兒童的畫作中能發覺其實他們也會成熟思考世界、社會與個人，期望透過兒童畫作反思，成年人該留下什麼樣的未來與星球給後代？如何讓他們無慮無懼在未來安心成長？「重生的力量」為一組手工木藝作品，由廈門市海滄區各學校的師生們利用莫蘭蒂風災後倒伏的樹木、樹枝創作出而成；「未來城市」為一組暢想「未來城市」風貌的陶磚作品，由去年加入大展的台灣高雄左營文府國小的學生們製作。大展特別邀請大陸知名攝影家王琛，精選其「地球」環保系列的航拍攝影作品在「當代對話未來」版塊展出，讓觀眾換個視角俯視「融化的南極冰川」、「乾涸的黃河」、「水分蒸發的沙漠鹽湖」等景觀，並思考人類賴以生存的地球，希望喚起公眾關注地球生態、守護地球家園的環保意識。本屆展覽由中國大陸宋慶齡基金會、台灣中華文創發展協會、雲揚天際文化藝術機構聯合主辦，台灣藝術教育館、廈門市思明區人民政府、廈門市海滄區人民政府、頂新公益基金會協辦。讓更多兩岸青少年獲得學習和交流機會。北京展結束後，展覽將在福州、廈門繼續展出。第八屆海峽兩岸少兒美術大展「未來會怎樣？」北京展今天在「今日美術館」登場，海峽兩岸暨港澳300多位孩童透過藝術創作共同暢想未來，展示了天馬行空的靈感和想像力，為觀眾開啟了一次奇妙的時空穿越之旅。展期持續至7月18日。五月分別在台灣的台北市和台南市展出的「第八屆海峽兩岸少兒美術大展——未來會怎樣？」今天移師北京，作為大陸首展，北京展開幕式吸引了眾多觀眾、媒體前來觀展、報導。以「未來會怎樣？」為主題，從兩萬多名海峽兩岸暨港澳兒童畫作中，挑選200多幅獲獎作品展出。孩子們通過繪畫作品表達了對生態、環保問題的關注，展示對未來世界的想像。策展人周櫻表示，「童畫天地」展覽有4環節，包括「小人憂天」、「共生或毀滅」、「未來會更妙」與「未來我作主」，畫作內容有科技期待、未來理想實現、憂慮環境惡化與戰爭恐懼。她指出，「小人憂天」表達孩子們對未來地球爆炸、宇宙毀滅的擔憂；「共生或毀滅」是孩子們對生態、環保問題的關注，警醒眾人關於未來該如何選擇；「未來會更妙」展示孩子們對未來世界的科學幻想；「未來我做主」展示孩子們對未來奇幻生活天馬行空的靈感和想像。周櫻說，從兒童的畫作中能發覺其實他們也會成熟思考世界、社會與個人，期望透過兒童畫作反思，成年人該留下什麼樣的未來與星球給後代？如何讓他們無慮無懼在未來安心成長？「重生的力量」為一組手工木藝作品，由廈門市海滄區各學校的師生們利用莫蘭蒂風災後倒伏的樹木、樹枝創作出而成；「未來城市」為一組暢想「未來城市」風貌的陶磚作品，由去年加入大展的台灣高雄左營文府國小的學生們製作。大展特別邀請大陸知名攝影家王琛，精選其「地球」環保系列的航拍攝影作品在「當代對話未來」版塊展出，讓觀眾換個視角俯視「融化的南極冰川」、「乾涸的黃河」、「水分蒸發的沙漠鹽湖」等景觀，並思考人類賴以生存的地球，希望喚起公眾關注地球生態、守護地球家園的環保意識。本屆展覽由中國大陸宋慶齡基金會、台灣中華文創發展協會、雲揚天際文化藝術機構聯合主辦，台灣藝術教育館、廈門市思明區人民政府、廈門市海滄區人民政府、頂新公益基金會協辦。讓更多兩岸青少年獲得學習和交流機會。北京展結束後，展覽將在福州、廈門繼續展出。
udn201707092217001,https://udn.com//news/story/7266/2573531?from=udn-ch1_breaknews-1-99-news,鹿港鎮1隻公鹿的死 引爆結核菌防疫大作戰,2017/07/09 22:17,小鹿，人見人愛，但彰化縣鹿港鎮有一隻公鹿死了，卻讓彰化縣動物防疫所、彰化縣衛生局、農委會防檢局大為緊張；因為公鹿被檢驗出牛型分枝桿菌，就是人畜共通的牛結核，鹿公園緊急封閉，防疫單位展開溯源防疫大作戰！四月間，這隻公鹿被苗栗飼主賣到鹿港，從耳標顯示已13歲。鎮長黃振彥介紹牠亮相時，公鹿體形削瘦，沒什麼精神，眾人都以為牠是「人生地不熟」，內向、怕生的關係，呵護有加，不少人距離互動，沒想到當時牠應早已感染牛結核菌，命在旦夕。鹿港為什麼沒有鹿？去年10月，鎮長黃振彥決定打造鹿公園帶動地方觀光產業，先引進6隻母梅花鹿，今年4月間再從苗栗一家民營鹿場買進一隻公鹿；7月1日這隻公鹿暴斃，因屬鎮產，鎮公所商請彰化縣動物防疫所出具「死亡證明」準備核銷，剖驗後才知代誌大條了。彰化縣動防所長董孟治說，防檢人員解剖公鹿後發現肺臟有膿包，直覺可能感染結核菌，緊急全面消毒處理，並將肺臟、肝臟的檢體急送彰化縣家禽衛生試驗所化驗；4日家試所通知「疑似牛型分枝桿菌」，即牛結核菌，因這是法定的人畜共通傳染病，立刻通報農委會防檢局、彰化縣衛生局。「防檢局已通報苗栗縣政府對出售公鹿的養鹿場，採取全面防疫措施。」董孟治說，剩存的6隻母鹿經抽血檢驗都呈陰性，暫時排除感染牛型結核菌，因結核菌潛伏期長，依規定需在8個月內再進行二次複驗，才能確定沒感染，已要求禁止移動，工作人員也需接受檢查。董孟治說，鹿園面積約二分地，因結核菌可能藏在土壤裡及陽光照不到的地方，未來8個月，防疫人員將每2至3天到公園消毒1次。幸好這隻公鹿變成鎮產，疑感染牛結核暴斃的問題才會曝光，並及時掌控。鹿港鎮公所為行銷鹿園，舉辦為小鹿鹿命名活動，原定7月15日票選，出事前每天都有不少親子到鹿園與鹿互動。彰化縣衛生局呼籲民眾能自主管理，若出現久咳、有痰、發燒、倦怠、體重減輕等症狀，求醫時，要告訴醫生曾到鹿港接觸過鹿。鎮長黃振彥說，他引進梅花鹿希望成為鹿港特色，也確實吸引很多親子與小鹿開心互動，發生公鹿暴斃事件，讓他很沮喪；管制的8個月期限過後，其他6隻鹿若確定沒問題，將重新開放鹿園，讓民眾和小鹿近距離互動。小鹿，人見人愛，但彰化縣鹿港鎮有一隻公鹿死了，卻讓彰化縣動物防疫所、彰化縣衛生局、農委會防檢局大為緊張；因為公鹿被檢驗出牛型分枝桿菌，就是人畜共通的牛結核，鹿公園緊急封閉，防疫單位展開溯源防疫大作戰！四月間，這隻公鹿被苗栗飼主賣到鹿港，從耳標顯示已13歲。鎮長黃振彥介紹牠亮相時，公鹿體形削瘦，沒什麼精神，眾人都以為牠是「人生地不熟」，內向、怕生的關係，呵護有加，不少人距離互動，沒想到當時牠應早已感染牛結核菌，命在旦夕。鹿港為什麼沒有鹿？去年10月，鎮長黃振彥決定打造鹿公園帶動地方觀光產業，先引進6隻母梅花鹿，今年4月間再從苗栗一家民營鹿場買進一隻公鹿；7月1日這隻公鹿暴斃，因屬鎮產，鎮公所商請彰化縣動物防疫所出具「死亡證明」準備核銷，剖驗後才知代誌大條了。彰化縣動防所長董孟治說，防檢人員解剖公鹿後發現肺臟有膿包，直覺可能感染結核菌，緊急全面消毒處理，並將肺臟、肝臟的檢體急送彰化縣家禽衛生試驗所化驗；4日家試所通知「疑似牛型分枝桿菌」，即牛結核菌，因這是法定的人畜共通傳染病，立刻通報農委會防檢局、彰化縣衛生局。「防檢局已通報苗栗縣政府對出售公鹿的養鹿場，採取全面防疫措施。」董孟治說，剩存的6隻母鹿經抽血檢驗都呈陰性，暫時排除感染牛型結核菌，因結核菌潛伏期長，依規定需在8個月內再進行二次複驗，才能確定沒感染，已要求禁止移動，工作人員也需接受檢查。董孟治說，鹿園面積約二分地，因結核菌可能藏在土壤裡及陽光照不到的地方，未來8個月，防疫人員將每2至3天到公園消毒1次。幸好這隻公鹿變成鎮產，疑感染牛結核暴斃的問題才會曝光，並及時掌控。鹿港鎮公所為行銷鹿園，舉辦為小鹿鹿命名活動，原定7月15日票選，出事前每天都有不少親子到鹿園與鹿互動。彰化縣衛生局呼籲民眾能自主管理，若出現久咳、有痰、發燒、倦怠、體重減輕等症狀，求醫時，要告訴醫生曾到鹿港接觸過鹿。鎮長黃振彥說，他引進梅花鹿希望成為鹿港特色，也確實吸引很多親子與小鹿開心互動，發生公鹿暴斃事件，讓他很沮喪；管制的8個月期限過後，其他6隻鹿若確定沒問題，將重新開放鹿園，讓民眾和小鹿近距離互動。
